,Title,Post Text,ID,Score,Upvote Ratio,Total Comments,Created On,Post URL,Original Content,Saved,year,month
9,Request: Public Perception Of EDs And How It Hurts," 

Hello, I have struggled with both AN and BED. I currently am trying to overcome BED. It’s a daily struggle. Scratch that. A moment to moment struggle. Currently I’m on a streak of emotional eating every single day for the last while. It’s been rough.

And I know this is going to sound horrible but, compared to my days of AN, this is so so much worse. Now, I am slightly larger than a good weight for me.

I get dirty looks. I get double takes if I wear something that shows a bit of cellulite or exposes a tummy roll. I have resorted to covering up all the time. Today I wore a turtleneck. It was 76 degrees. I sweat through my shirt underneath.

When I had more controlling and restrictive behaviors, I would actually get compliments. It was awful and alienating to receive positive feedback considering the negativistic attitude I had about feeding myself. But, nonetheless, I was received in an approving, even at times, envied, way. How messed up is that?! One ED is shamed, the other glamorized! Both hurt. And I don’t mean to further the glamorization in this post. The grass is greener, huh. I just miss fitting into my clothes, feeling confident in my skin. When I go to shop now, I look at things and want to shop for the old me, it feels surreal.

More than anything, I want to have a healthy and uncomplicated relationship with food. I’ve been trying for a long time to achieve this. Therapy. Books. Food journals. Apps.

I just feel at the end of my rope and I just wanted a space to vent.

Thanks.",b23fox,36.0,1.0,2.0,2019-03-17 09:18:45,https://www.reddit.com/r/EatingDisorders/comments/b23fox/request_public_perception_of_eds_and_how_it_hurts/,0.0,0.0,,
10,Request: what are your small victories?,"  I binged and purged for the first time in a couple weeks. But, I’m trying not to beat myself up over it and fall into that self-hatred cycle. So looking on the bright side I was able to recognize where the behavior came from 100%: I’m in a new country and completely alone, really struggling after 3 months here of pure traveling. Furthermore, the purge wasn’t even really about the calories as much as it was about just wanting to not feel sick and get rid of all the junk sugar I had just put into my body. So, I feel like those are small victories. Very small and I still have a long way to go, but even two months ago I would have engaged in these unhealthy behaviors and not thought twice about it. Never would have taken the time to examine the emotional underpinnings, and it would have been just about the calories out, not how my body felt. 

&#x200B;

What are some small victories you experience that are still worth celebrating?",b5nnw5,35.0,0.97,15.0,2019-03-26 09:41:47,https://www.reddit.com/r/EatingDisorders/comments/b5nnw5/request_what_are_your_small_victories/,0.0,0.0,,
11,Request: Cooking helped me get better," 

Cooking for myself every  day has helped me recover from bulimia and I've been in remission for  several years now. When I cook for myself, I see exactly what I'm going  to eat and I become familiar with it. Bulimia is all about control and  I've found a nice, moderate approach to meeting my body's needs.  For instance, I try to eat lots of veggies. I take veggie snacks to  work, I get produce delivery, and I try a new veggie every week or so to  encourage diversity in my eating and cooking habits. I enjoy eating and  I take time making my food. Cooking is how I unwind from a hard job and  while it means standing for a little longer, it's totally worth it. My local grocery store has certain 50% off deals for produce they want  off the shelves and I use that to diversify my diet as well. I take  reusable shopping bags and I have some cheap reusable produce bags that I  bought online so I can get the fresh items. I've maintained food's specialness without hurting myself. 

&#x200B;

This has been  an ode to one of my favorite hobbies and I thought this might help  someone here have a good weekend.",awmkgm,37.0,1.0,4.0,2019-03-02 21:24:31,https://www.reddit.com/r/EatingDisorders/comments/awmkgm/request_cooking_helped_me_get_better/,0.0,0.0,,
0,Request: Does anyone else avoid going out because they think they’re too big?,I haven’t socialized in about a year because I feel so insecure. Has anyone else done this?,bde2u0,241.0,1.0,25.0,2019-04-15 09:44:14,https://www.reddit.com/r/EatingDisorders/comments/bde2u0/request_does_anyone_else_avoid_going_out_because/,0.0,0.0,2018.0,4.0
1,Request: My boss says she doesn’t eat and I’m struggling to not relapse," 

I’ve recovered physically  from anorexia, at least for the almost most part. I’m about 5 months  into a new job, and I have a great boss who is a few years older than  me, who rarely eats during the work day, 8am-6pm. We’re in an office of 4  people. She likes to say that everyone knows she doesn’t eat, whereas  I’ve been eating ok for a while now in recovery. 

I’m really struggling with my own body image, and constantly try and  compare my size with everyone I see daily, and I think she’s skinner  than me. I’m very competitive and she’s able to not eat and function  well, whereas when I didn’t eat I felt horrible and my hair was thinning  a lot.

How do I ignore her daily comments on not being hungry and her not  eating, since I know it’s triggering me? Is she ok and struggling like  me, or maybe she’s healthy and I’m imagining  it? I can’t say anything,  she’s my boss!

I’ve started restricting at lunch and not eating any snacks during  the day since I don’t want to be seen eating food. Even when I feel  nauseous and I end up drinking a lot of water to avoid eating. I’m  stressing over eating breakfast and dinner now too. I feel the need to  slim down just in case. I’m supposed to be skinner than everyone else  els in real life.

I’d really appreciate advice and tips, I’ve actually been enjoying  eating, lightly restricting though, but almost at my target weight so no  one knows by looking at me about my past struggles. It’ll be hard to  fully restrict again, but I’m trying so hard to convince myself that I  should and finalize that decision. I just get so much panic and guilt  when I eat and enjoy the food! Please. I’ll so conflicted and angry at  myself.",bc6pgd,69.0,0.97,8.0,2019-04-11 23:27:48,https://www.reddit.com/r/EatingDisorders/comments/bc6pgd/request_my_boss_says_she_doesnt_eat_and_im/,0.0,0.0,2018.0,4.0
2,"Request: Girlfriend's ED is getting bad, what do I do?"," 

Hello all, I need some help pretty badly.

Recently, my (22M) girlfriend (22F) has begun to sink back into an ED that she once overcame. Since recovery, she gained weight to a healthy level, but her dysmorphia came back as well. She refers to herself as fat, although she is so far from it. I try and tell her that she is beautiful, fit, etc. but nothing works anymore.

Also, she has taken to begging me to insult her so she feels driven to restrict. A usual evening activity has become her begging me to call her ugly/fat and getting angry and dismissive when I refuse. She accuses me of trying to sabotage her. I'm feeling very overwhelmed and depressed by all of this, and really need some help.

p.s. She has refused therapy and professional help, although she went through counseling in the past.",bbk4vv,58.0,1.0,14.0,2019-04-10 09:50:59,https://www.reddit.com/r/EatingDisorders/comments/bbk4vv/request_girlfriends_ed_is_getting_bad_what_do_i_do/,0.0,0.0,,
3,Request: Can eating disorders be considered as trauma?,"I was on the net the other day and I found a few comments talking about how once people recover from their eating disorder, they categorise it as trauma. I’ve never felt like the same person after recovering from my ED and I believe forever I’ll carry the weight that believes that I’ll never be able to live a worthwhile life anymore unless I’m participating in it. (I’m fine now).  Can any experience with mental illness then be considered as trauma? Would you only categorise it as something that is an experience that is lived through?",bgvhmt,56.0,0.97,10.0,2019-04-24 14:46:57,https://www.reddit.com/r/EatingDisorders/comments/bgvhmt/request_can_eating_disorders_be_considered_as/,0.0,0.0,,
4,Request: losing Weight Without Relapsing," 

Hi I'm sorry if my formatting is weird or I'm not doing this right. I haven't been using Reddit for very long. But I really wanted some advice.

I have struggled with binge eating and restricting since I was in highschool. And now I'm in college and morbidly obese by my BMI. I wanted to make a change so I've been trying to lose weight without relapsing. But it's so difficult. I've lost some weight through low carb and counting calories. But it's such a difficult line to walk.

I have to be strict about my calories but not too strict. I have to think about what I eat but not too much. I have to actually avoid situations where I know my trigger foods will be available.

Does anyone have advice on how to lose weight without reverting back to your eating disorder?",bejlee,51.0,1.0,21.0,2019-04-18 09:42:02,https://www.reddit.com/r/EatingDisorders/comments/bejlee/request_losing_weight_without_relapsing/,0.0,0.0,,
5,Request: Chewing and spitting out food,"For those whom are in recovery for bulimia or still suffering, has anyone experienced chewing and spitting out food? I’ve been struggling with this for over a year now ontop of bulimia and restricting. I find myself buying a crap tonne of junk (chocolate, ice cream, pastries etc) to hide in the toilet and chew and spit it out! Just like how I would in a binge but without actually swallowing or purging my food. I find it so bloody gross and I’m doing this daily as I’m trying to reduce binging and purging. I haven’t purged in 2 weeks!! Which is good but I need to get ahold of this chewing and spitting and binging. Any advice? Thanks",bb5w18,35.0,1.0,40.0,2019-04-09 09:36:00,https://www.reddit.com/r/EatingDisorders/comments/bb5w18/request_chewing_and_spitting_out_food/,0.0,0.0,,
6,Request: How to lose weight healthily after an ED,"I literally made an account so I could post on this subreddit so forgive me if I’m doing this wrong in any way.

I’ve suffered with anorexia since I was 14. (I’m 24). I’ve technically been in recovery for about 4ish years now but I still have a lot of disordered thinking. I’ve also gained a lot of weight within those years and I’ve become very slightly over the weight considered normal for my height. But at the same time I used to be such an active person (I was a dancer) so seeing myself like this without muscle and honestly bigger than I’ve ever been is really jarring and messing with my self image. 

I want to try and lose weight in a way that is actual healthy for someone like me and get me into a healthy and fit body. From all the research that I’ve done, it seems like it’s not really possible. I’m constantly being told to just love and accept my body for what it is.** But if it’s causing me constant suffering to the point of where I’m afraid I’ll relapse I feel like that’s not the best course of action. I always feel better when I feel I’m actually working towards a goal, but I have no idea how to do it in a way that won’t cause a relapse. I’m currently working with a nutritionist so that I can maybe increase my metabolism but it still seems like nothing is working and I’m at a loss

**Other issues I have with the “just accept your body for what it is” mentality is that none of my
clothes fit correctly or look right so I have no confidence about my appearance and I am much too broke to actually go buy new clothes (not to mention how triggering clothes shopping in general is). Also my career of choice sadly relies heavily on appearances and I fear I am actively losing opportunities because of how I look currently. It’s not something I am willing to give up.

Is there any hope for me? I have no idea what to do. I just want to be happy and healthy in my body.",bh2i7j,33.0,0.89,16.0,2019-04-25 01:02:44,https://www.reddit.com/r/EatingDisorders/comments/bh2i7j/request_how_to_lose_weight_healthily_after_an_ed/,0.0,0.0,,
0,Request: does anyone ever 'miss' their ED?..,"*TRIGGER WARNING* 

i know it sounds crazy, but, i sometimes miss my eating disorder. Its something thats almost always in the back of my head and i dont really know who i am without it.😕 
 On one hand it sucked but on the other hand it helped me cope with my emotions. It was my best friend, my security blanket and my form of feeling in control of my life. Sometimes when i feel depressed or lonely or really anxious i end up restricting or purging to take my mind off of the other stuff. It distracted me in a way.
 I just feel kind of lost rn and dont know what im doing with my life. Nothing really feels familiar to me except the ED. its almost sort of comforting in a weird way. 
Anyway im just wondering if anyone else can relate to this feeling/ mentality. 
Thanks",bl58lc,192.0,0.99,53.0,2019-05-06 00:31:49,https://www.reddit.com/r/EatingDisorders/comments/bl58lc/request_does_anyone_ever_miss_their_ed/,0.0,0.0,2018.0,5.0
1,Request: Today I stop tracking my calories and macros,"I thought that tracking calories would maximize my fitness journey's results. Consequently, I have been doing it religiously and obsessively for the past 8 months non-stop.
Starting with dinner today (which is in about 30 mins from writing this), I'll stop logging calories, 
Why?
I really feel that
1/ given my somewhat OCD/perfectionist nature (I don't have OCD though, lol, just very mentally strict with some things ocassionally), I feel that this was slowly developing out of control, to the point where I am on the verge of (but haven't) developing an eating disorder. I have first-hand experience with friends/family with ED, and I know it destroys lives (beyond just its victim). I'm glad I haven't developed ED, am sympthetic to those who have, and refuse to ever develop it.
2/ I have wasted so much time and effort on it - inputting food to the gram, researching the cooking method before eating it, etc.
3/ I've sacrificed so many opportunities (to make and hang out) with friends and families
4/ missed out on so many good (but healthy) foods. I used to love cheese, but have had periods where I avoided them because of minimum/maximum calorie and macronutrient requirements
5/ It isn't even that accurate. Let's be honest: companies fail in their food labels, you probably don't know your exact TDEE (which is made more volatile due to varying daily activities), and you don't always measure stuff correctly anyways
6/ even if every measurement and bit of labelling were accurate, the actual calories published are just estimates, even for the most basic whole foods like rice or oil
7/ your body doesn't treat all macronutrients the same (beyond total energy balance, a calorie is not a calorie), and doesn't absorb 100% of the macros you eat anyways
8/ it's costly: I sometimes had to go buy stuff last minute because food I already had ready at home did not fit my macros
9/ just more mental freedom really
10/ hindering my gains at the gym: (not applicable to everyone): - for a very long time my obsession with certain caloric and macro intakes have slowed down my progress because I feared I might over/under eat
11/ Lost productivity - I spend my time thinking way too much about meal planning, when I could've gone out and make money, study harder, or just play some FIFA (soccer video game).
12/ Personally, I don't intend to compete in anything professionally (bodybuilding, professional sports, ...) that requires obsessive control of macro and caloric intake; I'm just someone who enjoys physical exercise, wants to get big and strong and fit
13/ I can still look and feel healthy, stay fit, and have decent physical performance when needed (e.g. if I have to help someone carry stuff), and good bloodwork without calorie and macro tracking
There are probably a couple more reasons, but I think 1/, 10/, and 11/ are the most important ones.",bmfhrr,83.0,0.97,5.0,2019-05-09 04:29:42,https://www.reddit.com/r/EatingDisorders/comments/bmfhrr/request_today_i_stop_tracking_my_calories_and/,0.0,0.0,2018.0,5.0
2,Request: People/influencers who claim to use fitness to overcome their ED?,"I see so many Instagram accounts of people who follow intense lifting programs and are super “fit,” claiming that they have overcome their eating disorders through lifting, etc. These people seem to still be obsessed with food and exercise and although being (physically) super fit, I question whether fitness has just allowed them a new (socially condoned) way of continuing their disordered thoughts and behavior? I was wondering if people had thoughts on this.",bts0ve,60.0,0.97,18.0,2019-05-27 22:04:27,https://www.reddit.com/r/EatingDisorders/comments/bts0ve/request_peopleinfluencers_who_claim_to_use/,0.0,0.0,2018.0,5.0
3,Request: Survey on Disorder Eating and Body Image Concerns,"Hi, I’m currently working on a thesis project that aims to understand factors that may serve to protect against disordered eating behaviors (e.g., strict dieting, overeating, binge eating) and body image concerns. If you have some time, I’d love for you to fill out the survey below! It will take around 20 minutes. Thank you! 🧡

https://researchsurveys.deakin.edu.au/jfe/form/SV_bEFcjDYTyl6TuCh",bmwghv,48.0,0.98,34.0,2019-05-10 10:06:45,https://www.reddit.com/r/EatingDisorders/comments/bmwghv/request_survey_on_disorder_eating_and_body_image/,0.0,0.0,,
4,Request: post request- Anyone ever experience restriction in other areas of their lives?,I have noticed that along with food my restrictive tendencies tend to also affect my spending and amount of fun time. I have also gotten into living more environmentally friendly and have restricted my plastic use severely. Are these all other ways for me to punish myself? Any advice for how much is ok?,bt623d,39.0,1.0,12.0,2019-05-26 09:36:28,https://www.reddit.com/r/EatingDisorders/comments/bt623d/request_post_request_anyone_ever_experience/,0.0,0.0,,
0,"Request: How do you deal with waking up in the morning, looking in the mirror, and seeing your body different everyday?"," 

I don’t know how to be okay with seeing parts of myself as bigger or smaller everyday, or even if these changes are real. I’ve dealt with body dysmorphia for almost as long as I can remember, and even with therapy once a week, I still struggle with accepting what I see in the mirror everyday. Every morning I wake up and inspect my stomach, thighs, arms to make sure they aren’t bigger or different than they were the previous day, and every morning I look different to myself. Does anyone else feel as though their body fluctuates everyday? Is this real or just dysmorphia messing with my mind? Any advice would be more than greatly appreciated.",c0d7hy,116.0,1.0,16.0,2019-06-13 23:49:31,https://www.reddit.com/r/EatingDisorders/comments/c0d7hy/request_how_do_you_deal_with_waking_up_in_the/,0.0,0.0,2018.0,6.0
1,Request: Do you ever really recover,"I can’t imagine ever having a healthy relationship with food. I can’t take this for much longer, I know I look too skinny and I know I’m harming my body but I can’t even imagine eating a meal and not feeling like shit and making myself throw it back up,,, I really cannot live like this




Sorry if I’m requesting to post wrong I’m just drunk and looking for advice I’m so sorry if this is triggering or breaks post rules",bynnlj,50.0,1.0,11.0,2019-06-09 18:56:29,https://www.reddit.com/r/EatingDisorders/comments/bynnlj/request_do_you_ever_really_recover/,0.0,0.0,2018.0,6.0
2,Request: “Just eat healthy”,I’m a little past overweight and trying to recover from an ed. I’m in a hospital program and my girlfriend knows all of this. Today i wanted to go to the beach but had a breakdown because clothes don’t fit me like they used to and she got really upset at me telling me to “just stop” saying mean things about myself (I know I shouldn’t but I was really upset). And when we were calling later she’s like “if you want to lose weight why don’t you just eat healthy?” And that hurt a lot. I can’t formulate the right words to explain why that bothers me so much. Does she think I didn’t try that first? Does the think I am faking the disorder? Does she think I don’t fight with myself whenever I get symptoms? Does she think I want to be fat? She knows my goal in recovery isn’t supposed to be weight loss. I’m just really really hurt.,byvwqt,46.0,0.95,17.0,2019-06-10 09:51:08,https://www.reddit.com/r/EatingDisorders/comments/byvwqt/request_just_eat_healthy/,0.0,0.0,,
3,Request: I feel gross for eating.,"I’ve dealt with anorexia in my young teenage years. I gained a lot of weight when I got older and got treated for my mental health issues. I’ve tried for years with diets and gym, and finally I’ve gotten to the point where i constantly losing weight. I still have some to lose, but I have gone from a healthy diet with chicken, to barely eat anything at all. 

I have the weekends where I enjoy chocolate and a bowl of popcorn, but yesterday I felt gross for eating. And it has been like that with all foods for the past five days. I feel sick and disgusted over being hungry and I’ve basically starved myself these five days. I finally managed to eat properly yesterday, also a few tortillas with beans. That’s is. And I felt horrible. Stomach cramps and nauseous. I’m scared. 

I’m at loss, and I’m scared I’ll end up like I did when I was a teen.

I’m 28 and struggle with depression, which also has gotten worse over the past days.",c0xict,49.0,1.0,2.0,2019-06-15 13:52:50,https://www.reddit.com/r/EatingDisorders/comments/c0xict/request_i_feel_gross_for_eating/,0.0,0.0,,
4,Request: Is it normal to go through cycles of recovery and relapse without any trigger?,"For the last significant portion of my life I have been suffering from fear of eating. Right now I'm very underweight but not long ago I was a healthy weight and I don't know what even triggered my anxiety again for me to start obsessing about food and making me stop eating. So yeah my question is, is it normal to relapse for no reason with no trigger?

Thanks anyone that helps. I'm very desperate.",c1gi5a,45.0,0.99,7.0,2019-06-16 23:32:44,https://www.reddit.com/r/EatingDisorders/comments/c1gi5a/request_is_it_normal_to_go_through_cycles_of/,0.0,0.0,,
5,Request: How do I accept the fact that I have an eating disorder?,"I'm finally going to a therapist specializing in eating disorders starting July, but I constantly doubt myself and go back and forth from ""I have an eating disorder"" to ""I just have low self-esteem and I'm overreacting."" I know I fall under almost all the characteristics of anorexia, but I'm at a healthy weight and I don't purge so I constantly feel like a fraud. I don't know what to do or how to cope or whatever. I feel like because I'm not doing as bad as other people with eating disorders that I don't truly have an eating disorder and that I don't need help. All advice welcome, thanks!!",c6eea5,43.0,0.99,11.0,2019-06-28 02:17:32,https://www.reddit.com/r/EatingDisorders/comments/c6eea5/request_how_do_i_accept_the_fact_that_i_have_an/,0.0,0.0,,
6,Request: Things are going far better than I'd anticipated,"Hi, everyone. I just wanted to share with you how much I appreciate this sub. Today it's been 72 days since my last purge. I can't remember last time I felt that good. It's the longest I didn't purge in 6 years. 
I mean I still have these intrusive thoughts and sometimes it's not easy to eat my dinner. I gained a couple of kilos and that also makes me a bit sad. But I am NOT relapsing, can you beleive that???
This sub and my therapist saved me, I am sure. I feel almost healthy. I feel like I can make it to 90, 100, 1000 days. I'm typing this post and crying. I feel sorry for myself, for who I was. But I am hopeful, I enjoy my food and I finally felt full and liked it. 
I got a part time job so I could embrace my hobbies.
I love my bullet journal. I love my ceramics. I love taking a nap during the day. And I love my breakfast, my lunch, my snacks and my dinner. 
There is hope! Please enjoy life. There is a way to recover and thank you for showing it to me!",c5yy29,39.0,0.96,6.0,2019-06-27 01:05:44,https://www.reddit.com/r/EatingDisorders/comments/c5yy29/request_things_are_going_far_better_than_id/,0.0,0.0,,
