,Title,Post Text,ID,Score,Upvote Ratio,Total Comments,Created On,Post URL,Original Content,Saved,year,month
0,"Request: Obese to underweight, recognize problems, fail to adhere to regular diet. Sidebar is ovewhelming.","In November of 2016, I read about a man who had lost weight by eating one meal daily. The article was very well written, and also made sense back then, it went somewhere along the lines of, as long as most of your needs are met, eating one huge meal and supplements and eating six carefully planned meals at a caloric deficit makes no difference. I had had enough of being fat for most of my life and I wanted to change, for myself, and nobody else. Was 19 at the time, am 21 now, a guy all the time, if this info is necessary.

By October I was comfortable with having whatever was being served at my Uni cafeteria and some dark chocolate to go with my afternoon coffee, vitamin supplements and nothing else throughout the day. The only time I deviated from this plan was when I had some drinks with friends and a couple of times during the holidays last year. As you might imagine the weight loss was noticeable, compliments were flying, and, because the only meal I had throughout the day was a social one, nobody suspected a thing. But, as with anything, I started obsessing about my weight loss, the compliments felt good, and I wanted more. It started with cutting the extra meat from my meal, then cutting the dessert from that one meal, then cutting the dessert, then the bread, then the chocolate alongside my coffee, and then I started being picky about the meat and side dish itself, as in, no more lasagna, no more fried stuff, and so on. It ended with cutting everything but meat, veggies, fruit, being picky about the pasta and rice, I even cut the freaking soup, and the only drinks I ever had were either coffee (as black as my soul, not even with stevia), tea and water.

The year went by, as went my kilos, and my mental state. By July I had lost a small child worth of weight, and my mind. Having not realized it at the time, I was basically a vegetable. I would come home from class and waste my time watching YouTube or TV shows from my childhood (I mention this because it probably had a calming effect, reminiscing about a time I did not have to care about anything other than missing Ned'd declassified and Zoey 101, actually, Nick in general and whichever video game I had been playing at the time), because there is Bob's burgers only once per week. Like lie in my bed, and not do anything else, not only did I stop studying, i stopped playing video games dammit, did not hang out with friends, hell, the only social interaction I ever did was lying to my parents about why I failed another exam. After failing most of my exams I came home for the summer. My parents had known how I lost the weight but didn't express any concern until they had actually seen how big of an idiot I am. Some stern talks, expresses for concern, some fighting and a lot of crying (mostly me) later, as in, some combination of that daily, for a few weeks, I have realized the errors in my ways. I probably wouldn't even have done that, but while we were at the seaside I managed to lose a significant chunk of weight as swimming and not eating make you do that, and that was when shit hit the fan.

As most of us know, the sight of ones mother crying because of ones actions can prompt absolutely anything and I had decided to return to a regular diet and make as much right as I could. And this is where the current problem starts. I had to return to uni because I still had the possibility to pass everything I had failed until then. I adhered to a strict five meal diet during the three and a half weeks I spent at uni basically only eating, studying, and the occasional walk, managed to pass everything but one and returned home triumphant, yeah, not quite. I had not gained any weight. Cue crying, accusations, and a bad atmosphere. I had some two weeks at home before the new semester, and they notice I eat regularly, but at the time something else became abundant. I did not know what to eat as I didn't want to gain all my weight back, a problem I did not deal with at Uni because I had bigger things to worry about. So I became picky, 5 meals but, not this, not that, not that either, only black coffee, tea, water, rice cakes instead of bread, etc.

And this is the problem I am still facing four months later. By now I am still worried about what I eat, will not eat anything I can't log into MyFitnessPal, will have multiple meals, but sometimes just two, sometimes six, ranging from big meals to ""basically not a meal"" kind of meals, and even then I restrict the number of calories I eat, and have started exercising using the 30 day fitness app, but have stopped because Uni is hell atm. But because I stopped exercising I also stopped eating that much, restricting my calorie intake even further. I ate my ass off during the holidays, but still gained only 2 kilos in three weeks. Am thinking about foods constantly, obssesion comes to mind. Sometimes I overeat for a meal and eat only fruit/veggies for the rest of the day or the next day to compensate. I've noticed I am cold all the freaking time and, my sex drive is nonexistent, like, I don't even take care of myself anymore. Motivation is all over the place, as you can see by the bad post, or, the decline in quality and details from start to end.

I am crying as I write this, I do not know what to do, or where to go, or who to talk to. I don't want to burden my parents as they have enough on their mind right now. I just want to return to a regular normal diet, and life. What kind of freaking ED do I have, how do I fix it, what, when and how much should I eat as to maintain current weight? Do I just start an x calorie diet and stick to it, do I work up to it, do I lay on the bed and cry? Do I provide some extra detail for you to figure out? Or do I just talk to a professional? Do people do counseling for free? Is this the wrong sub?",7qgazx,35.0,1.0,6.0,2018-01-15 01:31:48,https://www.reddit.com/r/EatingDisorders/comments/7qgazx/request_obese_to_underweight_recognize_problems/,0.0,0.0,2018.0,1.0
0,Request: showers,"I hate taking showers because I have to see my body.

Has anyone experienced this? What can I do?

",7x6osk,33.0,0.96,10.0,2018-02-13 03:51:19,https://www.reddit.com/r/EatingDisorders/comments/7x6osk/request_showers/,0.0,0.0,2018.0,2.0
0,Request: Reddit is enabling my eating disorder,"I was set off by a specific comment that I read on a specific sub dedicating to a more intense diet regime. There's nothing wrong with dieting this way, but recently there has been scrutiny of the sub because of that fact that it harbors many people with eating disorders. There's on particular comment, very well upvoted, that says that nobody who really has anorexia would eat anywhere near around x (a low number) calories.

That low number of calories got me to a dangerously low BMI. It led to anemia, syncope, obsession, c/s, and yes, an anorexia diagnosis.

But no, ~real~ anorexics eat *even fewer*, always. I was just disciplined enough to eat x calories, right?

I was doing so well with my recovery. But if people think that my habits are normal dieting behavior, even when your BMI started out low, what am I recovering from?

I've read similar comments in other subs. It seems like my behavior has never been disordered. How can I recover when society is praising me for my behaviors and trying to emulate them?",8an32g,41.0,0.91,5.0,2018-04-08 02:24:50,https://www.reddit.com/r/EatingDisorders/comments/8an32g/request_reddit_is_enabling_my_eating_disorder/,0.0,0.0,2018.0,4.0
1,Article: Eating Disorders Don't Discriminate (About men with eating disorders),,89c3w8,38.0,0.96,5.0,2018-04-03 10:00:54,http://www.34st.com/article/2018/04/male-eating-disorders-discriminate-penn-anorexia-bulimia-diet-restriction,0.0,0.0,2018.0,4.0
0,Request: A little tip for anyone recovering from anorexia: make a video,"Back in 2016 when I was at my anorexic worst (BMI in the danger zone, exercising compulsively, etc.), I decided to make a video.

Here's what I did: I stuck my webcam on, started recording, took my top and jeans off so I was just in my underwear (bear with me), and did a little turn for the camera.

It served a few purposes—such as acting as a good way to determine how much healthier I looked and to document the recovery process—but now it serves one I hadn't anticipated.

It's not a magic switch, but now, every time I think about skipping a meal, I play that video. And holy shit does it work wonders sometimes. Skeletor Me is sad and very shocking to look at and I nearly teared up when I re-watched it yesterday, but I suppose that's the point: a shock to the system, a reminder that one skipped meal is where it starts.

And y'know, maybe I'll summon the required balls to eat something and still have trouble actually holding it down, but it's the effort of trying now that leads to the resilience built in the future. It doesn't work every time, it's not a magic Cura spell, but for the most part it acts as a great deterrent against skipping meals. As if to say, 'Remember this? Yeah, me too. Let's not do that shit again, yeah? Be brave, knobhead'.

Just an idea. One that's saved me more than a few times since then. Good luck with the rest of your journey xx",8mmvnf,63.0,0.98,9.0,2018-05-28 02:52:19,https://www.reddit.com/r/EatingDisorders/comments/8mmvnf/request_a_little_tip_for_anyone_recovering_from/,0.0,0.0,2018.0,5.0
1,Request: How do you stop thinking constantly about the calories in food?,"How do you stop thinking constantly about the calories in food? If i look at an apple I just think 60 calories, if I look at a cup of yogurt I think 120 calories. I'm constantly doing math in my head and constantly worried about my intake. I'm sure this is just a part of having disordered eating (I've never been diagnosed, but I've always been obsessive). Any tips on how to work through this and eventually move on would be amazing. Some things I'm trying and they're sort of working (except I still do the math) are mindful eating, and allowing myself to have treats because I do workout and know that I need to eat more.

",8lm7eg,42.0,0.96,8.0,2018-05-23 19:31:57,https://www.reddit.com/r/EatingDisorders/comments/8lm7eg/request_how_do_you_stop_thinking_constantly_about/,0.0,0.0,2018.0,5.0
2,"Request: Recovered anorexic, now objectively overweight, advice on how to lose the weight and not relapse","I would consider myself recovered/in recovery from anorexia for the last fifteen years. I’ve been married for nine years to an amazing cook and have gained weight. Enough that my doctor nags me about losing weight - so between that and the scale, I feel like I have objective data.

For the last month, I’ve been doing a lot of strength training and cardio. I’ve started to run again, I can tell that my endurance is better, and am see actual muscle definition. All of which is awesome.

The food is more of a challenge - I am trying to make healthy food decisions, work on reasonable portions,etc. I am terrified that I will over restrict and there are days when I hear that voice creeping into my head.

I can’t find any studies or objective data about people in recovery trying to lose weight via healthy choices.

Does anyone have sage advice on how to stay on track with recovery while simultaneously staying on track with a healthy weight loss plan??

Thanks in advance!!",8jtm4m,44.0,0.95,20.0,2018-05-16 09:39:13,https://www.reddit.com/r/EatingDisorders/comments/8jtm4m/request_recovered_anorexic_now_objectively/,0.0,0.0,2018.0,5.0
0,Request: Recovery Finally,"My wife has had an ED since she was 13.

We’ve had a hard road with it, but she’s resisted a intensive treatment. We tried very hard for years to “do it ourselves”, but at best had moderate success, usually temporary.

She finally kind of hit rock bottom, and agreed to go into an inpatient program about 3 weeks ago. She’s been taking it incredibly seriously, and is working harder on this than she has on anything else I’ve seen her do. She looks, sounds, and feels alive for the first time in a long time.

It’s lonely, but we have visiting hours about 4 days a week. The program is lovely, and provides great support.

Tangentially, we closed on a house at the same time, and so she’s excited to not have to move, but also, I’m excited she gets a clean break and a new start. The night before being admitted was the last time she will ever be in the old place.

She’s described her ED as almost its own entity, and kind of like a voice in her head. For years “it was [her] only friend.” I’ve told her this is a demon, it will say anything to kill her. Today she gets her first pass and will see the new place all moved into. We are going to sage the house; we are going to exorcise that motherfucker.

I just wanted to share something happy.",8q1y1p,74.0,0.99,7.0,2018-06-10 16:33:16,https://www.reddit.com/r/EatingDisorders/comments/8q1y1p/request_recovery_finally/,0.0,0.0,2018.0,6.0
1,Request: Food Is Ruling My Life And I Can No Longer Tell When I'm Hungry,"So I've have disordered eating on and off for years. Lately though, I will barely eat anything all day and then have a big meal at the end of the day. I have no problem eating out at restaurants, which I go to with friends and my boyfriend a lot, but it's really hard for me to eat when I'm alone at home. This past week I have been completely exhausted, no matter how much I sleep. I also am training for a half marathon and sometimes don't have enough energy to run.

I can't tell the difference anymore between being hungry and just psychologically wanting to eat. It really scares me. I'm not losing that much weight, so I don't think I'm under-eating by that much. I'm thin but in the normal range. But eating alone has become really stressful and is consuming all my thoughts.

What type of help should I look for? I don't want to gain any weight, but I also don't want to live like this anymore.
",8rfkql,33.0,0.95,8.0,2018-06-16 00:07:00,https://www.reddit.com/r/EatingDisorders/comments/8rfkql/request_food_is_ruling_my_life_and_i_can_no/,0.0,0.0,2018.0,6.0
0,Study On Eating Behaviours: Participants Needed!,"Hello,

I’m a PhD Student in psychology at Queen’s University in Kingston, ON. I’m currently investigating the relationship between disordered eating, perfectionism, and interpersonal relationships—and would very much appreciate your help/participation!

Participation would entail completing some online questionnaires (link below). It should take less than 15 minutes. This is, of course, completely voluntary! However, people who complete the survey will be entered into a raffle for $25 (CAD) Visa gift cards. Specifically, 1 gift card will be given for every 25 people who participate. For example, if there are ultimately 75 people who respond to the survey, then three raffles—each for $25—will take place.

The link to the survey is [HERE](https://queensu.qualtrics.com/jfe/form/SV_9TbE2j0iYXunmn3), or alternatively copy and paste the following link into your browser: https://queensu.qualtrics.com/jfe/form/SV_9TbE2j0iYXunmn3. Your responses will be kept completely anonymous. Please feel free to contact me at 13pl28@queensu.ca if you have any questions or concerns!

Thanks in advance for any time you can spare!

Pauline",8y4ev9,48.0,0.97,14.0,2018-07-11 23:06:44,https://www.reddit.com/r/EatingDisorders/comments/8y4ev9/study_on_eating_behaviours_participants_needed/,0.0,0.0,2018.0,7.0
0,Request: feeling the need for every meal to be “perfect”,"Does anyone else feel the need or desire for all their meals to be “perfect?” Like it has to be the right time to eat, you have to have measured the correct amounts of whatever you’re eating, take a certain amount of time to eat and not be interrupted or disturbed while eating? This makes me sound crazy maybe, and I’m reasonably flexible day to day with most of my meals, but I just prefer if I’ve planned everything “perfectly” and all goes according to plan. Breakfast at 8, lunch at 12, snack at 3, dinner at 7, etc and I get to eat exactly how much I want with out anyone asking for any of what I’ve alreadg measured... I’m recovering from an ED and eating the right amount of calories, but this perfectionism about food and not wanting it to be interrupted or derailed is definitely the hardest thing to shake. Does anyone have advice for me?",9gepcc,56.0,0.99,12.0,2018-09-16 22:12:32,https://www.reddit.com/r/EatingDisorders/comments/9gepcc/request_feeling_the_need_for_every_meal_to_be/,0.0,0.0,2018.0,9.0
0,Request: Is My Daughter Developing An Eating Disorder?,"She's 15 and she just asked for a fitbit for her birthday. She's been skipping every single breakfast and almost never eats her lunch that I give her, and when she eats dinner, she only takes about 1/2 or 1/4 of what the rest of the family takes. The thing is, when everyone is in their rooms at night, I can hear her sneak into the kitchen and get food. I guess, Im confused and worried... Also, she's been diagnosed with depression and anxiety, the last thing we need is for her to have an eating disorder as well. ",a15692,59.0,0.98,29.0,2018-11-28 10:52:19,https://www.reddit.com/r/EatingDisorders/comments/a15692/request_is_my_daughter_developing_an_eating/,0.0,0.0,,
1,Request: No more,"I am done. I feel burned out, hopeless, helpless and loveless. Looking into the mirror I see a tired mare shadow of my former self. My hair, my teeth, my nails, my breasts ... it’s all messed up. Today I have decided to recover from bulimia. I have struggled with eating disorders for the past 10 years of my life (I recently turned 21), from bulimia specifically since nearly 7 years. I have tried recovery and therapy so many times. I did not work out. I am very scared and I don’t want to get fat, but this time ... I will do it. On my own. No matter how hard it is. No more excuses ... no more “ah only one time purging is fine”. I made up my mind. Wish me luck ...",a1rf9q,43.0,0.99,5.0,2018-11-30 10:51:07,https://www.reddit.com/r/EatingDisorders/comments/a1rf9q/request_no_more/,0.0,0.0,,
2,Request: How do you deal with having your photos taken?,"I very rarely take photos of myself and I avoid situations where I'd have to let other people do that. However, sometimes that's difficult to refuse - e.g. my boss has recently hired a professional photographer to take shots of all of the employees for the company website.

I'm in full-panic mode because I know I'm going to be triggered when I see these. Photos are a lot like scales to me; I know I'm at a much healthier weight now than I used to be, but I can't deal with that reality yet. I start obsessing over the way my collarbones and arms and thighs looked in older photos, where I was seriously ill, and feel the need to punish myself for losing self-control.

Moreover, these photos are going to be up on the company website for God knows how long and I'm already freaking out that everyone will get to see how much I've let myself go.

I'm interested to hear your guys' opinions on the best methods or coping skills for handling these invasive thoughts?",9vzsti,37.0,0.94,5.0,2018-11-11 01:21:11,https://www.reddit.com/r/EatingDisorders/comments/9vzsti/request_how_do_you_deal_with_having_your_photos/,0.0,0.0,,
3,Request: How Do You Deal With People Celebrating Your Weight Loss?,"I was overweight when I first started restricting, and I'm currently at a healthy weight, if it matters. The problem is, people keep telling me that I look great, they're so proud of me, or what's my secret, they wish they could do what I did, etc. This happens both with people who don't know I was anorexic and people who do know. I just have no idea how to react. I hate the idea of saying thanks when someone compliments me on the weight loss, and it feels uncomfortable to lie and say ""just diet and exercise!"" when someone asks me how I did it. I really don't wanna make a big deal out of it or tell people I don't know that well about my history, so I need help navigating these comments.",9uk1x3,40.0,0.98,12.0,2018-11-06 01:54:52,https://www.reddit.com/r/EatingDisorders/comments/9uk1x3/request_how_do_you_deal_with_people_celebrating/,0.0,0.0,,
4,Request: How do I get food off my mind?,"I get so frustrated with myself, I feel so messed up. Food is on my mind all the time. I don’t restrict anymore and try to eat big portions, in hopes it stops me from thinking about food and counting down the minutes to the next time I get to eat. After a meal, I usually feel full and satiated, but i’ll start thinking about how long it will keep me full for-whether or not I can have a snack-if i’ve overeaten. These thoughts take over my brain for hours and I just can’t live in the moment. Some say that if you are thinking about food, it means you are hungry, but even when I do eat- I just think the same things and feel guilty because I wasn’t hungry and i ate. I try to keep myself distracted but nothing seems to work. These thoughts really only come through when I am feeling fat/bloated. I want to let go and just think about food when i’m hungry!!!! Any advice??? I’m so thankful for this page, makes me feel less alone in my struggles. Hope the best for all of you ❤️
",9zro2k,37.0,0.93,6.0,2018-11-23 20:18:24,https://www.reddit.com/r/EatingDisorders/comments/9zro2k/request_how_do_i_get_food_off_my_mind/,0.0,0.0,,
0,Request: Christmas Cookie Party Win!,"Tonight I went to a Christmas cookie contest party. I made cookies without binging on them (Rare). And I ate 4 cookies at the party and didn't purge (Rarer). I had such a great time since I wasn't obsessively focused on the food. 

I am beginning to love fighting back against my ED and not letting it have power over me. It's so empowering and makes me excited for a future free from this disease. I am working so hard to recover but I'm still B/P 3-5 times a week. It's a huge decrease from how much I used to B/P but lately I've just been getting frustrated with my recovery and how sick I still am. So these kind of days mean the world to me. 

Sending healing vibes to you all!",a6oaod,71.0,1.0,10.0,2018-12-16 11:12:44,https://www.reddit.com/r/EatingDisorders/comments/a6oaod/request_christmas_cookie_party_win/,0.0,0.0,2018.0,12.0
1,Request: Am I Faking An Eating Disorder?,"It always feels like I don't actually have an eating disorder, I'm just faking everything, or a ""wannabe anorexic"" or whatever. Im 16F, diagnosed with anxiety and depression, and currently seeing a therapist. So for about 6 months now I've been heavily restricting, eating very little during the day but almost always ending up by binging at the end because I can't control myself. It makes me feel worse, which then makes me want to restrict more, etc... But ive barely lost any weight, so every morning when I restart restricting, it feels like I'm ""trying"" really hard to prove that I have self control and that I can be skinny, when really I'm just eating and eating and eating and just trying all over again. I don't know if that made sense but basically I just feel like nothings actually wrong with me, I just suck at weight loss.

",a2zjyq,54.0,0.97,25.0,2018-12-04 10:36:28,https://www.reddit.com/r/EatingDisorders/comments/a2zjyq/request_am_i_faking_an_eating_disorder/,0.0,0.0,2018.0,12.0
2,Request: My Thoughts On The Morning Following Christmas Dinner,"It’s the morning after my family’s christmas dinner. I ate a lot, and as much as I wish I could’ve eaten a smaller amount of food, and ate only until fullness- I didn’t. I was looking around for posts about overeating on Holidays so I could feel less alone and there aren’t too too many. Last night, I felt slightly crazy going back for more and more bites of cake on top of having way too many cookies, whilst everybody else just had one piece. I felt guilty and thought people were probably judging me. Holidays are scary- You have the appetizers, the main, the bread and cheese, the dessert, the drinks. It’s terribly hard not to overeat. It’s like I can’t tell if this was a binge or not. But despite last night- I will still eat breakfast and continue my day as normal. I don’t feel too guilty and even though I ate more food than I can even remember, I didn’t feel sick and uncomfortably after my meal which is a success in my eyes. I’ve got ANOTHER family get together tonight, I will try to focus more on being with my family rather than the food. I’m starting to realize that overeating on holidays is pretty normal- one or a few days of doing it will not wreck me or make me spiral. Next time I will try to do better but I have to stop beating myself up. Also I found that is has helped me to think about old times and realize that I don’t remember what I ate. Even though I put so much importance to what I consume on a given day, it slips my mind and I only remember the interactions, the people, what I did... I don’t know. I also like to tell myself that I have eaten this much before, maybe more and I was FINE. 

I will be okay. You will be okay.

",a9t8ce,33.0,0.95,6.0,2018-12-26 22:49:00,https://www.reddit.com/r/EatingDisorders/comments/a9t8ce/request_my_thoughts_on_the_morning_following/,0.0,0.0,2018.0,12.0
