,Title,Post Text,ID,Score,Upvote Ratio,Total Comments,Created On,Post URL,Original Content,Saved,year,month
6,"Request: Post Request: Are other people's perception of ""healthy"" distorted?","Hey. So I've struggled with Anorexia Nervosa B/P Subtype for many years. I'm 20 years old and had hit my lowest weight this year. I have recently gained a small amount of weight, like single digits. But I've been eating consistently for about a month straight and having a lot of energy. I have stopped using diuretics but still taking a lot of stimulant laxatives. Anyways, my BMI is severely low (I have been hospitalized and had heart attacks at a higher weight than my current) yet people are telling me I look ""glowing"" ""so great"" ""way healthier."" Someone even commented on my full face when in reality my face is so swollen from purging so much. I'm trying so hard and eating a lot everyday but these comments are so discouraging. Like, if I look so healthy at this severe of a low weight (literally, I've had an ng tube at a higher weight and everyone said I looked so ill), than what am I gonna look like if I ever reach a normal weight? This is making it so much harder for me to stop taking laxatives. I'm so frustrated and my therapist is the only one who sees that I'm struggling. It's like since I'm able to drive again and not slitting my wrists everyday and been showering and putting on makeup, everyone thinks I'm healthy now. Even my guy friend said I look ""so hot with the weight on"" and I literally began bawling and told him to never comment on my weight again because it makes me uncomfortable. Is my therapist wrong about me needing to keep eating? How can people think I'm healthy in five weeks when it took me 7 years to get this sick?",cogc2f,41.0,1.0,12.0,2019-08-10 10:15:53,https://www.reddit.com/r/EatingDisorders/comments/cogc2f/request_post_request_are_other_peoples_perception/,0.0,0.0,2019.0,8.0
7,Request: Mother buys my trigger foods. Is it OK if I throw them out?," 

So let me give a short background. I've struggled with an ED since I was about 13, so a decade now. My psychiatrist has categorized it as EDNOS, because I have episodes of anorexic like behaviors and then bulimic like behaviors.

I've lived with my parents throughout this. They don't know all the nitty gritty details. They know I've been properly diagnosed. They'll notice when I lose a lot of weight. My mom will sometimes comment on it. My dad never does. If they don't see me eat for a long time, they'll ask about when the last time I ate was. Overall, they don't really stick their noses too much into it. Probably because (due to my Hoshimoto's disorder and low thyroid), no matter how much i restrict and over exercise, I never lose enough weight to look dangerously emaciated, and my BMI tends to stay towards the low end of normal. So obviously it's not as serious, right? -.-

Anyways, I have trigger foods, of course. There are specific foods that I ask my mom not to have in the house. It's not a long list. It really only consists of a few things, sweets like: pecan rolls, a couple specific kinds of cereals, a couple specific kinds of donuts, a couple specific kinds of candy, and one type of cookie. White chocolate macadamia nut. When I say a couple specific, I do really mean like 2 or 3 kinds. That leaves at least a dozen other options in each category. In total, the list is probably less than 10 things.

Now she knows the reason. It's not like I asked and said ""just because."" I SPECIFICALLY told her, I don't want them around me, because if I have one, I will binge and then purge. If I'm already in a binge/purge episode, it's almost guaranteed. If I'm not, it can lead to a binge, and start me into one of those episodes.

She KNOWS. that I have a VERY legitimate reason to be afraid of having them in the house.

She does ok with not buying candy or donuts very often. She still buys all the other foods on my short list, though. I do my best and can usually keep myself away from them. Though that usually leads to me restricting even more, so I can feel like I have more control to keep myself from eating them.

Now, the white chocolate macadamia nut cookies. I dont know why, but they are the bane of my existence. Those are the problem.

My dad likes having cookies around for a before bed treat. He's not picky. He likes all cookies. I've asked him, in front of my mom, if he cares if she does not bring those ones home. He said no, they're not even his favorite, so he does not care.

My mom brings them home at least every other week. And at this point, it makes me SO. MAD. She's not even TRYING to take into consideration the ONE thing I've asked her to help me with. Why????? So when she brings them home, I throw them out. I'm fucking sick of it. It makes me mad. I know im wasting food and I feel bad wasting money. BUT IF SHE DOESNT WANT ME TO THROW THEM OUT, ALL SHE HAS TO DO IS PICK ONE OF THE OTHER 10 KINDS OF COOKIES. And she won't. So is it wrong of me to do that?

TL;DR I ask my mom not to bring home a certain trigger food for my eating disorder. She doesn't care, so I throw them out whenever she buys them. Is that wrong?",cnk2ek,35.0,0.97,13.0,2019-08-08 10:53:35,https://www.reddit.com/r/EatingDisorders/comments/cnk2ek/request_mother_buys_my_trigger_foods_is_it_ok_if/,0.0,0.0,2019.0,8.0
0,Request: “i wish i had your eating disorder”,"this is something that a couple of my friends have said to me. and it pisses me off to no end. 

ive dealt with almost every eating disorder since i was a pre-teen. it all began with me binge eating, which led to me gaining my weight and getting an extreme amount of self hatred and body dysmorphia. then that turned into bulimia. ive gone through phases of obsessively counting calories, purposely starving myself, and just generally having an awful relationship with food. ive gained and lost weight countless times, many times in a short period of time. and right now i guess i would be considered anorexic. so ive kind of been through it all. 

two of my friends are self diagnosed binge eaters. one of them i completely believe, she goes to therapy (pretty sure she’s diagnosed) and we’ve talked about our relationship with food before. the other one however seems to just generally eat too much because she likes food and occasionally uses the label. im not trying to say she doesn’t have any issues with food, it just seems like she throws around the label of an eating disorder very loosely. 

anyways, both of these friends have made comments before about “i wish i had that eating disorder” and “haha i got the wrong eating disorder” and especially “we get it. youre skinny”. and it really fucking sucks. like ive had years of obsessing over every bite of food that goes into my body. most of the time i cant even enjoy food. and they act like they’re jealous of it. 

this is mostly just kind of a rant because its on my mind. its not something either of them say often, and they aren’t purposely trying to hurt me. i was mostly just curious if anyone else has dealt with something like this, or if you have any advice on how to handle it",d90x1s,109.0,1.0,6.0,2019-09-25 09:36:44,https://www.reddit.com/r/EatingDisorders/comments/d90x1s/request_i_wish_i_had_your_eating_disorder/,0.0,0.0,2019.0,9.0
1,Request: Responding to the question “Do you think I’m fat?”,"Some background info: My girlfriend and I have been together for just over 3 years. In all the time I’ve known her she’s been underweight, and she recently confided in me that she has had a difficult relationship with food for a long time. She was diagnosed with an eating disorder just under a year ago and around then she lost a significant amount of weight in a short period of time.

Since then she has made some amazing steps and has put some weight back on (although she is still a ways away from her weight when we first met, and by extension what her doctor would classify as healthy) as well as tackling the psychological aspect of recovery head on.

I’m extremely proud of her and trying to be as supportive as possible and this sub has been incredibly helpful for advice, but one thing I’m still struggling with is the question she sometimes asks: “Do you think I’m fat/gross/heavy?” I’m struggling with how to answer this in the best way and I hoped I could get some advice from you all. 

So far, I have responded with a “No.” followed by changing the subject slightly by telling her how proud I am of the progress she’s made in such a short space of time, trying to draw attention to the positives of her recovery so far without focussing on the weight.

One thing I’ve been actively trying to avoid saying is something like “No, you look healthy” or “No you look fine”. Some other threads I have read on this sub suggested that telling someone they look “healthy” can also be demoralising, and I feel to say “fine” would be to downplay the progress she has made. 

In addition to this I’m also trying to avoid this language so as not to normalise the weight she is currently at, although I am wondering if this is a valid concern?

This is all very new to me and though I’m trying the best I can any advice on this subject would be extremely helpful, thank you.",cz47l6,69.0,0.98,21.0,2019-09-03 12:28:54,https://www.reddit.com/r/EatingDisorders/comments/cz47l6/request_responding_to_the_question_do_you_think/,0.0,0.0,2019.0,9.0
2,Informational Post: Have you heard of a disorder called ARFID?," 

A lot of people saw a BBC article about a boy recently who went blind because of malnutrition caused by his own poor diet. While the BBC briefly mentioned ARFID in their article, their title heavily capitalized on the stigma around picky eating, and other articles even went as far as to blame the victim, calling him fussy, or to blame his family.

[https://sciencebasedmedicine.org/a-british-teenager-is-blind-but-not-because-of-junk-food-or-fussy-eating/](https://sciencebasedmedicine.org/a-british-teenager-is-blind-but-not-because-of-junk-food-or-fussy-eating/)

That boy suffered from ARFID, Avoidant/Restrictive Food Intake Disorder. ARFID is a more recent discovery among food disorders, being only a few years old, making it a recent addition to the DSM5.

ARFID is characterized by an unwillingness to eat anything except for certain ""safe foods."" People with ARFID come in all shapes and sizes and vary in what their safe foods are and how many they have. For some, ARFID seems to stem from childhood experiences with food, but that doesn't hold true for all. They often blame texture for why they don't like new foods. For someone with ARFID, trying new foods causes great anxiety or even panic attacks. Trying something new comes with the fear of throwing up. It doesn't matter how hungry you are, with ARFID, one will gladly starve instead of eating a non safe food.

With the stigma around picky eating, it's often difficult for someone with ARFID to eat out at restaurants or at friends' houses. People try to push eating new things without understanding how difficult ARFID makes it, and if you turn down any offers of food, people become worried or judgemental. People wonder how you can say you don't like a food you've never tried. Sometimes parents who's children have ARFID will force them to try new things or try to wean them off safe foods, but this tends to do more harm than good. More info here: [https://notapaperjournal.wordpress.com/2019/09/06/arfid-awareness-101/](https://notapaperjournal.wordpress.com/2019/09/06/arfid-awareness-101/)

There's very little awareness about ARFID compared to other eating disorders, and it can be hard to find information about it. Right now, our subreddit is having a mass growth because of the BBC article. Many of us have suffered ARFID all our lives thinking that we were alone, suffering some strange, nameless thing that nobody else has. If you think you or someone you know may be suffering from ARFID, you are not alone.

We may not have a national ARFID day, but we have a support subreddit over at [/r/ARFID](https://www.reddit.com/r/ARFID) . We also have a discord server you can join from there. Our subreddit has a WIP food encyclopedia pinned, which may help ARFID sufferers find foods that are very similar to their safe foods to try. Thank you for taking the time to read this, and best of luck to everyone no matter what you're going through <3",d2a3ie,61.0,0.98,25.0,2019-09-10 16:29:58,https://www.reddit.com/r/EatingDisorders/comments/d2a3ie/informational_post_have_you_heard_of_a_disorder/,0.0,0.0,2019.0,9.0
3,Request: My little sister is showing signs. Help," I’m 19 and struggled with bulimia heavily for years . My little sister is in 4th grade and  has been making concerning comments about food and weight and portraying the early habits of an eating disorder. I try to talk to her about it every time I catch her saying those things, but it’s really difficult because I don’t know what the right thing to say is. I really don’t want her to be like me and I need some advice on things I Should say. If anyone began ED habits at a young age let me know what you wish someone would’ve told you before it was too late.",d9sxxj,55.0,0.99,9.0,2019-09-27 00:53:32,https://www.reddit.com/r/EatingDisorders/comments/d9sxxj/request_my_little_sister_is_showing_signs_help/,0.0,0.0,2019.0,9.0
4,Request: student seeking participant for questionnaire on eating disorders," 

Hello there! My cohorts and I have created a questionnaire for families affected by eating disorders in order to further understand their needs for learning more about EDs and how to further support their loved one. This questionnaire also applies to people who have or had experienced EDs as well. If you know someone (can be family or friend) who had or has an ED (diagnosed, undiagnosed, or suspected) please take the questionnaire. I really appreciate your time! Thank you so much. The following is the link to the questionnaire:

[https://forms.gle/99H7JKpFLW8X8E228](https://forms.gle/99H7JKpFLW8X8E228)",d6n1zn,51.0,0.98,7.0,2019-09-20 00:37:08,https://www.reddit.com/r/EatingDisorders/comments/d6n1zn/request_student_seeking_participant_for/,0.0,0.0,2019.0,9.0
5,Request: How to pick yourself back up after a binge?,"I hadn't binged in over a month but today I gave in. I don't plan out my binges, I guess one day it just comes over me and I decide to. Sometimes I get thoughts but I'm pretty good at resisting them. 

Tonight I felt very sad and alone after I got some upsetting news. I binged for comfort
 and it made me feel better in the moment, but now I just feel disgusting, awful, sick, and like a failure. I purged to ""compensate"" but obviously that made me feel worse. 

I feel like I'm just going to balloon up and gain a bunch of weight from this. Which really scares me. I don't know how to recover. What makes you feel better after a binge? I've just been crying pathetically, and thinking horrible things about myself, and regretting it.",cyng57,43.0,0.99,7.0,2019-09-02 10:49:46,https://www.reddit.com/r/EatingDisorders/comments/cyng57/request_how_to_pick_yourself_back_up_after_a_binge/,0.0,0.0,2019.0,9.0
6,Request: Binge eating is hindering my success,"I’ve been working out consistently since January. I was doing a program called strong curves up until recently. I have lost weight while doing this. 
I feel my progress would be a lot better if I had better control over my eating. I’ll eat and eat and not think twice until after the fact. It’s almost like the devil in my head saying “you don’t need to count it, just eat it. Eat it now” once I’ve consumed it,that’s when the self pity comes. 
I have NO control over my binge eating. My emotions take over 
Any tips?




Can you post this.",d5o86k,36.0,0.95,25.0,2019-09-17 22:20:24,https://www.reddit.com/r/EatingDisorders/comments/d5o86k/request_binge_eating_is_hindering_my_success/,0.0,0.0,2019.0,9.0
7,Request: worried about friend," 

Hey guys, my friend (16F) has been acting really strange lately and I didn’t know what else to do, so I thought posting here might be a good option. She has never had a huge stomach, but lately she’s been eating like only a granola bar at lunch. She claims that she eats a big dinner but I’m pretty sure she’s telling her parents she’s not hungry and eats at school. She also calls herself fat all of the time and talks about wanting to lose weight (she’s definitely not fat, she’s quite on the skinny side). She also says that she drinks a full bottle of water before she eats so that she’s “more full.” Lastly, she said she wants to join my schools swim team just because swimming burns a lot of calories.

These seem like pretty scary and abnormal things (I haven’t mentioned a few others as well) and I was wondering what I should do to help her out, without losing our trust and friendship. Thank you guys so much, I love her and I’m worried.",d4c4jf,37.0,1.0,9.0,2019-09-14 22:33:48,https://www.reddit.com/r/EatingDisorders/comments/d4c4jf/request_worried_about_friend/,0.0,0.0,2019.0,9.0
8,Request: does letting go mean relapsing or recovering?,"Can I trust myself?

What is good and what is wrong?

What do I want, anyway?

Where am I being too severe? What am I not addressing properly?

I want to let go. But after all these years, it seems like I don't even know what to let go of and what to keep.",d1igrb,34.0,0.97,4.0,2019-09-08 23:07:21,https://www.reddit.com/r/EatingDisorders/comments/d1igrb/request_does_letting_go_mean_relapsing_or/,0.0,0.0,2019.0,9.0
9,Request: Why am I burping so much?,"I have been trying to recover from my ED, and am now I am eating a bit more. But I cannot stop burping. 

In addition, I feel like I am going to throw up my food (which I have a fear of doing). 

Have you guys ever experienced this/what can I do to stop it?",d3rwdi,33.0,0.94,7.0,2019-09-13 16:38:31,https://www.reddit.com/r/EatingDisorders/comments/d3rwdi/request_why_am_i_burping_so_much/,0.0,0.0,2019.0,9.0
10,Request: ED recovered with ED best friend,"28f. I recovered over the last 4 years. I had a secret ED from 11-24, and I eat mindfully but not restrictively and I'm very healthy now. My best friend has finally accepted that she has one. For the last 3 years, it's gotten bad. She's a binger, but often tries to purge/abstain with little success (not that it makes a difference. Urges still there, still dangerous no matter what)

For the last 2 years, I've tried to tell her that her negative talk about herself affects me. I've tried to set boundaries many times but she always ends up going back to her old way of talking around me. It even bleeds into her social media. It's almost daily that she brings up her weight and how massive and disgusting she is (her words)

But I think she's beautiful. I tell her so.

She weighs the same as me with the same body type and measurements almost exactly. This hurts me both for her and me.

I don't know what to do anymore. I absolutely do not want to cut my best friend of 12 years out of my life, but it's so hard for me to talk to her. It's LITERALLY every day, sometimes more than a few times. It coaxes my bad thoughts right back up. What can I do that I haven't already? I really don't want to be harsh to her. She refuses help because she says she isn't ready, even after I explained to her that she probably won't ever be.",d30rph,35.0,0.97,7.0,2019-09-12 01:43:02,https://www.reddit.com/r/EatingDisorders/comments/d30rph/request_ed_recovered_with_ed_best_friend/,0.0,0.0,2019.0,9.0
0,Request: Do other people think they’re faking an ED?,"Hi everyone, I’ll make it short: I often feel like I’m faking my eating disorder and this thought is making me feel like an horrible person. I also have BPD and other issues, I talked to my therapist about this matter but she always reassure me saying that my problems are real. But there are some periods in which I’m not obsessed with food, I do not restrict nor I care about the calories or everything else I’d think/do normally. I always alternate periods of obsession and IDGAF. What does that mean? Omg I feel absolutely terrible when I’m able to eat like a normal person and then thinking “I actually have an ED” because it feels so...fake? So I don’t know, anyone else feels like this? It would be so encouraging knowing that I’m not alone.",dmhkpq,124.0,1.0,26.0,2019-10-24 14:57:29,https://www.reddit.com/r/EatingDisorders/comments/dmhkpq/request_do_other_people_think_theyre_faking_an_ed/,0.0,0.0,,
1,Request: Does it count as an eating disorder if you haven’t been officially diagnosed?,"I’ve been dealing with what I’m pretty sure is anorexia for about 2 years now. It included (at its worst) unsuccessful fasts and very low calorie days, in addition to just trying to put off consuming food as often as I possibly could. However, for reasons involving my mom being very nosy I’m not able to bring it up to my doctor and I really don’t want to. It feels like I’m dealing with all the eating disorder “symptoms” but I have no physical result. I feel like it doesn’t count because I’m not losing much weight and also I haven’t ever gotten diagnosed for an eating disorder.. so does it count if you haven’t even been diagnosed by a doctor?",dhg665,72.0,0.97,18.0,2019-10-13 20:36:31,https://www.reddit.com/r/EatingDisorders/comments/dhg665/request_does_it_count_as_an_eating_disorder_if/,0.0,0.0,,
2,Request: Mom doesn't acknowledge my recovery efforts and enables my ED.,"Request: Mom doesn't acknowledge my recovery efforts and enables my ED. 

Hello, I hope this is allowed here. I am currently (20F) and have struggled with an ED since I was 13. I was initially diagnosed with Anorexia Nervosa Restrictive Subtype but last year began abusing laxatives and diuretics so I am diagnosed as 'Purging Subtype.' I went through a six month period of severe B/P behaviors while at my lowest weight ever. Basically, I would fast all week, than plan a massive binge, than make myself purge all night. And repeated every. single. week. I was so miserable and so food obsessed. I would cook ridiculous meals like a buffet and eat until I would nearly vomit, I was torturing myself. In July, I began making some recovery efforts. Returned to my therapist, had to get stomach surgery from the damage my purging had done, and began attempting to eat more regularly. First just a solid, non restricted meal once a day, than twice, and now three times per day. My mother has been incredibly triggering and grows more angry with me at any efforts I take to further my independence. My grades and gpa have greatly improved, and as a foodie at heart, i am not only able to cook meals but portion them and eat. I have become much better at not asking for reassurance and instead assuring myself that i need to eat. My parents work a lot so I log my food via photography which i send to my best friend or therapist for support, and i even make efforts to bring snacks such as some muffins i bake, or a smoothie to school. I have deleted my calorie counters but i am not really able to eat at restaurants yet, as i dont feel mentally ready. 

My mother seems to miss my former B/P behaviors. I went through a really intense period of binging 10000+ cals per day, to the point where in july i needed hospitalization and as i mentioned earlier, a surgery due to severe bowel impaction. Sometimes, she implies that she misses these behaviors. I used to compare what I ate to her and refused to eat alone or while she worked, meaning i would wait to have dinner with her at 9 pm, usually fainting in the process or having a B/P session. She often puts down what I eat, as her and I have different likes/dislikes. I need wheat bread for my GI issues, and i tend to eat a lot of dark meat chicken which she claims is ""fattening"" which is just so triggering. I am usually hungry at much different times of day than her, like she wont eat til 1 pm where as I make breakfast at 8 am as i feel i really need a schedule. This evening for dinner we were ready to sit and eat and she said she was also going to have a bit of smoked salmon with her meal (we made lasagna). I told her i wasn't really in the mood for that and id pass. she said i NEEDED to have some. I said, ""i dont want any though. i dont make you eat foods you dont want to eat."" for example, she eats fish for dinner a few nights a week which im allergic to. i eat oats with peanut butter all the time which shes allergic to. she then told me she misses the old days when id make elaborate platters and host big dinners with the neighbors. i said ""those were binging and purging sessions. id wake up at 4 am, go for a run, than center my entire day around binging and purging. it was so painful. i dont miss any of that. i was going through a lot of pain."" apparently she sees those meals as lovely family time even though she saw how bad itd get. id throw up at the table. i was feeling tortured in my own mind. she also makes fun of my body. i wore a sports bra today and she said i looked disgusting and skeletal. i said ""im practicing body confidence. it was really hard to put this on. i was trying to feel more confident in myself instead of covering my body since its changed."" im not at my lowest weight anymore and trying to accept change. i really dont know what to do. i have mt friends and therapist in my corner encouraging me, but she is so toxic to my recovery. can anyone give me some advice?",dmva69,65.0,0.99,11.0,2019-10-25 10:05:26,https://www.reddit.com/r/EatingDisorders/comments/dmva69/request_mom_doesnt_acknowledge_my_recovery/,0.0,0.0,,
