,Title,Post Text,ID,Score,Upvote Ratio,Total Comments,Created On,Post URL,Original Content,Saved,year,month
7,Request: How to cope with weight gain?,"The past few years I've been anorexic and bulimic. I barely ate and when I did I would track my calorie intake. I ran everyday. I puked out every thing I've ate. I've lost a ton of weight but it wasn't enough for me. 

It got so bad that i had to go to the hospital. 

After that I realized I needed to change. I tried to eat regularly. I went vegan to convince myself to eat. I got rid of my weighing scale and my full body mirror (I constantly check my weight and my reflection to see if i gained weight or looked fat). I ended up trying out for our cheerleading team and that motivated me to continue eating so I wouldn't faint during my training.

For awhile I felt happy with my body. I was fit and healthy. I had no thought and signs of my eating disorder. I stopped counting calories and enjoyed eating. I realized how much I miss eating food. I got in a relationship soon after  My boyfriend is also an athlete with a high calorie intake so we would constantly go out to eat or go to buffets.

After game season ended we stopped training for a bit and I gained weight. 

I cried when i saw my body at the mirror. I cried when i saw my weight. I cried when i realized my pants don't fit anymore. 

I've been binge eating and I'd purge right after. I'm back to working out everyday. I'm so lost since I struggled so hard to recover and now I'm relapsing so hard. How do you guys deal with weight gain? How to handle relapses? I don't want to stay bulimic",c1w8q0,39.0,0.96,9.0,2019-06-18 01:50:41,https://www.reddit.com/r/EatingDisorders/comments/c1w8q0/request_how_to_cope_with_weight_gain/,0.0,0.0,,
8,Request: How to get a scale removed from the break room,"I want to make this post and the sidebar said message you guys.


I just started a new position at my job and they transferred me to another location. It's a financial institution, so there's no real reason for there to be a scale here. I can't just not go in the break room bc it's also where the printers are. I'm in recovery and haven't weighed myself in ages bc of it but of course the first thing I did was check my weight. I'm up almost 10lbs from my low weight. I rarely skipped lunch at my last branch, but I've only been here 6 days and I've skipped twice. I can't tell if I'm actually not hungry or it's that fucking scale sitting there haunting me and dragging me back into my ED. I want it gone, but how do I get it removed, at least from the break room, without raising flags? I just started here and don't want people to think I'm weird. If it gets out that ""someone"" asked for it to be removed it's gonna be obvious it was me bc everyone else has been here for at least a year. Who should I even talk to? I'm kinda new to the professional world so I have literally no idea how to navigate this.",by1njv,37.0,0.94,14.0,2019-06-07 23:57:58,https://www.reddit.com/r/EatingDisorders/comments/by1njv/request_how_to_get_a_scale_removed_from_the_break/,0.0,0.0,,
0,Request: commenting on my food at a party,"I'm a former anorexic who has also had issues with bulimia. Today I was feeling major swallowed up by my social anxiety...but I had to go to a friend's party. It was packed. The food line was crazy long and I was so stressed out about having to get in line and have everyone see me. I didn't know many people, so I felt especially nervous. In the past I would have just not ate.

   I am trying to do opposite actions. So I got in line. I got salad with fatty regular Italian dressing and a piece of lasagna. Was still afraid to eat in front of everyone...I ended up eating back in the kitchen by myself. A couple friends ended up joining me and it eased my anxiety some- had some laughs etc, etc.

   A couple minutes later I went back and got dessert. A small brownie and tiny piece of cake. Was feeling really proud of myself...and as I'm headed back to the kitchen a man stops me and says, ""you know that all turns to fat,  right?"" I said nothing and just looked at him...THEN a woman stops me and says, ""Hey, I saw those up there...I wonder if they're worth the calories"" I said, ""I don't know....I don't count calories"". Regardless, I ate the food. And I can't get their comments out of my head hours later. 

   I feel like I've been punched in the stomach and I don't know why. I find this kind of stuff especially detrimental to me and it makes me honestly hate people. I came home and ate too much food and I hate myself more. I just want to isolate and not go to parties ever. I literally forced myself to go to this one. How do you deal with this stuff? Am I overreacting?",cg6m2r,165.0,0.99,20.0,2019-07-22 01:03:44,https://www.reddit.com/r/EatingDisorders/comments/cg6m2r/request_commenting_on_my_food_at_a_party/,0.0,0.0,2019.0,7.0
1,Request: A little moment of celebration,"I have been in recovery for the past 6 months and today I finally got my period back!!!! I'm so happy to not worry about it anymore. After a year and a half of it missing, my body finally trusts me enough to have a cycle. 
:'''))))",ccx14g,82.0,0.99,5.0,2019-07-14 01:06:32,https://www.reddit.com/r/EatingDisorders/comments/ccx14g/request_a_little_moment_of_celebration/,0.0,0.0,2019.0,7.0
2,Request: I would like input on how to help my daughter,"My daughter is 14 and is struggling with body image issues. I recently learned that she will sometimes not eat for days, when she does finally eat it's a binge it seems. this has caused her to become sick enough to vomit. She is seeing a therapist but the therapist said today that if this continues she would need a therapist that specializes in ED. 

I have removed the scale from the bathroom and I'm trying to check in with her about how she's feeling and trying to make stuff she would want to eat. But I really don't know how to approach this.

Tomorrow is gonna be super hot but she said she wont go swimming, I guess cause she doesn't want people to se her in a swimsuit. She's so beautiful and is at a good weight for her height and age but no amount of reassurance is helping. Please help",c90ab4,67.0,1.0,26.0,2019-07-04 08:51:02,https://www.reddit.com/r/EatingDisorders/comments/c90ab4/request_i_would_like_input_on_how_to_help_my/,0.0,0.0,2019.0,7.0
3,Request: Humiliated by my family,"Unbeknownst to my family I have been dealing with bulimia/binge eating for a while now. I don’t live with them and I haven’t told them about it but recently I have been back home for a few weeks due to uncertain circumstances with my job and living situation. 

Being back home has been challenging because there is always someone there watching, meaning I have to be careful about what I eat and when etc as I don’t want them to find out. I stopped purging a few weeks ago but I still have issues with binging and overeating. It hasn’t happened much but on a few occasions I have binged in the middle of the night when I thought everyone was sleeping. My younger sisters bedroom is directly next to the kitchen so she has apparently heard me in there rummaging etc. Then I heard my mum talking to my brother and sister this morning about how all I do is eat and that all the food she buys is disappearing. She said she can’t afford for me to stay here eating her food so I either have to leave, buy my own food or give her money towards groceries. I think that’s fair but I just feel so humiliated that it’s gotten to the stage where my family are talking about it behind my back. I already feel ashamed about the amount of weight I have gained during recovery and it makes it even worse to know that my family are talking about me saying I’m greedy and some kind of pig that won’t stop eating.",cetmv0,57.0,0.98,6.0,2019-07-18 15:04:28,https://www.reddit.com/r/EatingDisorders/comments/cetmv0/request_humiliated_by_my_family/,0.0,0.0,2019.0,7.0
4,Request: Dealing with triggers in front of people???,"Hi, this is my first post here so I'm kinda nervous.  I'm 19F.  Currently I am rehearsing a musical and one of the cast members makes comments about their body and weight that make me really uncomfortable.  Not only do I worry for this person, but it triggers me and makes it hard for me to continue eating my lunch (this often happens at lunch time).  I've tried leaving the room, but I don't want to isolate myself from the rest of the cast.  Our director also mentioned one eating disorder by name while we were dry running a scene and to distract myself/calm down I drank half my water bottle.  I'm feel like my weird reactions are gonna draw attention to me and I don't want that to happen.  I'm just confused and nervous and any ideas or comfort would be greatly appreciated.",ck64n2,49.0,0.96,5.0,2019-07-31 09:30:24,https://www.reddit.com/r/EatingDisorders/comments/ck64n2/request_dealing_with_triggers_in_front_of_people/,0.0,0.0,2019.0,7.0
5,Request: How do you stop emotional over-eating?,"I am well into adulthood and can’t seem to stop eating bad food excessively when I’m stressed/depressed/tired. For my health, I need to stop, but I can’t seem to last more than a day or two. The harder I try to stop, the more I eat. I feel mentally and physically awful, but I can’t break the cycle. How do I do this? Help!",ca0mbe,40.0,0.96,6.0,2019-07-07 00:12:02,https://www.reddit.com/r/EatingDisorders/comments/ca0mbe/request_how_do_you_stop_emotional_overeating/,0.0,0.0,2019.0,7.0
6,"Request: Need advice, how to deal with other people’s commentary on your appearance?","Several years back I gained a lot of weight.  Through extreme calorie restriction, I lost the extra weight, and I got into lifting weights, but the restricted calorie diet gave me some pretty disordered eating habits. My relationship with food is very touchy and I still struggle every day to find the balance between binge eating and/or not eating at all. THEN, I went through a divorce within the past year, and got “too skinny” according to family and coworkers (which is so inappropriate for anyone to comment on). I have been struggling lately as my appetite has picked up (I work out a lot) so my muscle mass has increased which has led to some weight gain. I am at a healthy weight currently, and I know they mean well, but when people just take it upon themselves to point out that I look “healthier” and that I “was too skinny”, it is SUCH A TRIGGER.  It makes me feel like I have to restrict myself again since other people are noticing... how do you deal with that??",ci6ipm,39.0,0.98,7.0,2019-07-26 18:25:27,https://www.reddit.com/r/EatingDisorders/comments/ci6ipm/request_need_advice_how_to_deal_with_other/,0.0,0.0,2019.0,7.0
7,Request: Should I be worried if my partner who was previously hospitalized for an eating disorder is throwing up occasionally," 

My partner was hospitalized for an eating disorder about five years ago during college. She has talked to me about it and says that she is in recovery and has it under control but still struggle sometimes. I also have my issues and remind her she is lovable and worthy even if she struggles or is imperfect.

I’ve noticed that when things are going well she still throws up a couple times a month. When things aren’t going well (stress in our relationship, stress at her job, stress with her family) she throws up multiple times a week or even every day. I don’t bring it up when I notice.

I have asked if there is anything I can do to be supportive and she says It’s not my responsibility and she has it under control, which I accept. I’ve encouraged her to see a therapist (she has expressed wanting to see one just for a normal life help). Is there more I should be doing? I want to maintain healthy boundaries but also worry about her.",cf5ixc,39.0,0.98,9.0,2019-07-19 09:41:55,https://www.reddit.com/r/EatingDisorders/comments/cf5ixc/request_should_i_be_worried_if_my_partner_who_was/,0.0,0.0,2019.0,7.0
8,"Request: I used to suffer from anorexia, now it seems I have BED","So when i have suffered on and off with anorexia for the better part of 12 years. When my brother died it worsened and I barely held on. Over the past year and a half my brain has almost rewired itself and now I cannot stop eating. If I put one piece of food in my mouth I cannot see to stop eating after that. I purge on everything in sight and all I can think about is how to find more food. I consume a lot of calories in one sitting... I have gained loads of weight and I don't fit anything I own. I hate how I look but I cannot seem to control myself. I, unfortunately travel around for work so seeing a therapist is too difficult as I don't have a home based. I love this job, I love the freedom and the learning opportunities I am getting from traveling and exploring but I am so unhappy with my looks and I just don't know how to stop. I am posting here because I am hoping someone can offer me some advice or ways to curb my  over controlling eating. Don't get me wrong, I'm glad I am not starving myself anymore...I just wish I could find a happy medium... 😔",ceknw4,35.0,0.94,12.0,2019-07-17 23:34:27,https://www.reddit.com/r/EatingDisorders/comments/ceknw4/request_i_used_to_suffer_from_anorexia_now_it/,0.0,0.0,2019.0,7.0
9,Request: Does anyone else enjoy actually enjoy cooking?,"Request: Does anyone else actually enjoy cooking?

Hello. I have been struggling with anorexia and bulimia for seven years now, and I have found that one of the things that helps me abtain nutrition and sustenance is actually cooking for myself and family. Directly after treatment a couple years back I was onky encouraged to use things like cereals, bars, takeout, just things that were mostly prepared. Rarely was I ever making a meal from scratch. 
I actually really enjoy cooking and my family loves the food I eat. It is one of the only thing I can approach in a less disordered fashion (basically, I know that if I want my family to eat it, I have to make real food and not some weird ED concoction), so it encourages me to eat foods I'd normally be afraid of and taste things as I go. Eating out is still really tough atm. 

Do any of you guys like to cook? Do you eat with family/friends? What kinds of things do you find yourself preparing (if thats allowed to say)? I'm very curious if anyone else has the same interest because for me, cooking is one of the few things that doesn't produce extreme anxiety and I always feel proud when I've made something well. The fact that i enjoy cooking so much always surprises treatment providers, as they say that most prefer not to do so. Thanks for fhe input. :-)",cioxp7,32.0,0.93,12.0,2019-07-28 00:04:05,https://www.reddit.com/r/EatingDisorders/comments/cioxp7/request_does_anyone_else_enjoy_actually_enjoy/,0.0,0.0,2019.0,7.0
10,Request: How can I help my sister," 

I(22F) live in Japan with my family. My sister(19F) have ED and I need help to help her. I'm trying my best to read as much as possible about ED, but my own depression and anxiety don't let me think straight sometimes. I try to practice the ""I"" statement, but she does't like it when I say that I worry about her.

Sometimes I feel so useless that I just sit there by her side and cry... I can't deal with this anymore. I need a break, but I can't. My mom don't understand her ED and she just put this situation in my hands. My dad is an asshole, a few weeks ago, he came to our room and just yell at her things like: ""You're the one destroying this family"" , ""This is all fake"" and ""You are a dumbass, only stupid people does this to their parents"". This things are in her head now, she even said that that's true and that there's nothing I can say to change this in her mind.

My sister will start treatment for depression this Wednesday. I don't know how things will go. Hopefully she'll get proper help. I don't know.

I keep watching my sister to see if she needs to talk or go out. But I need help with what to say to her after she binges. Or for example when she gain weight (she was devastated this morning). I always fell like I need to do something or at least say something, but I can never find the right words.

I\`m sorry if there is any mistakes in this post. English isn't my mother language.",cdhmt2,34.0,0.97,5.0,2019-07-15 13:43:43,https://www.reddit.com/r/EatingDisorders/comments/cdhmt2/request_how_can_i_help_my_sister/,0.0,0.0,2019.0,7.0
0,Request: A good piece of advice I got recently,"I'm a 13 year old male recovering from anorexia, and I've recently become inspired to get involved in the community a little. I haven't been on reddit in quite a while but I decided that this is one way I could participate. Anyway:

I was going for a walk with my cousin (24 years old and female) whom I have always been very close with. She is also recovering from anorexia so we chat about it regularly. We were talking about it for a solid 2 hours, and towards the end, she gave me a piece of advice that I've thought about a lot since. She said that when she starts hearing the anorexia thoughts, one of her methods of dealing with them is to make them sound stupid. Like, I don't know, say they're serving cake at a party and you notice the eating disorder thoughts coming. If you take a step back and make them sound dumb, it really puts it into perspective. For instance, you could tell yourself (sarcastically, of course):

Okay, yeah. Let's have a freak out about this one piece of cake, I'm sure that will make for a good evening

I've done the whole thing, the therapy, the nutritionists, the hospitalizations, and I hate to admit it but this is the thing that I think of most in everyday life. It really has helped me. Everybody has their own methods of working through the thoughts, but I thought I'd just try and share it. I hope this helps someone out there (:",cnnzty,117.0,1.0,18.0,2019-08-08 16:20:14,https://www.reddit.com/r/EatingDisorders/comments/cnnzty/request_a_good_piece_of_advice_i_got_recently/,0.0,0.0,2019.0,8.0
1,Request: My sister has an eating disorder and is mad that I told our parents.,"I noticed over the summer that my sister's eating habits were getting strange. She'd skip breakfast and lunch, then tell our parents she ate a lot during the day to skip dinner. At first, I thought she was eating snacks when I wasn't looking, but it was getting pretty obvious that she just was not eating at all. I told my parents what I had noticed, and then they put her into therapy and pulled her out of her dance classes, which has been making her absolutely miserable. She knows that I'm the one who said something and is pissed about it. I feel awful that I caused her to get pulled out of dance, but I do want her to get the help she needs. But it's hard to deal with my sister hating me. I know, it's the eating disorder talking, not her, but a lot of it is still coming out of her mouth and I hate having to hear that from my sister. I feel like our relationship is ruined and I don't know what to do! How can I make it up to her?",cx9x3l,85.0,0.97,11.0,2019-08-30 01:08:37,https://www.reddit.com/r/EatingDisorders/comments/cx9x3l/request_my_sister_has_an_eating_disorder_and_is/,0.0,0.0,2019.0,8.0
2,Request: I finally told,"While running today (one of my terribly forced habits) I thought about the fact that I feel awful and I am clearly not eating enough. I know I have a problem. I finally decided I had to do something. I called my mother, and absolutely balled my eyes out while trying to explain that I need help. She was reluctant to believe me at first but in the end decided to arrange a doctors appointment. 

I regret it so much. I feel worse and can’t stop crying. I feel like I’ve ruined everything I’ve done for so long. I’m just going to get fat again. I’m going to hate myself. I already do.

Is it entirely normal to regret telling and regret trying to recover? I really wish I hadn’t said anything and my head keeps telling me I’m fine. I don’t know what to do now",cmebxb,51.0,1.0,10.0,2019-08-05 17:51:59,https://www.reddit.com/r/EatingDisorders/comments/cmebxb/request_i_finally_told/,0.0,0.0,2019.0,8.0
3,Request: ward experiences,"Hi I'm (15F) and I was hospitalized earlier this year.
Personally I hated my experience and it didn't exactly motivate me to get better. I'm just really confused by everything.

I stayed at the hospital a bit and nothing noteworthy happened there, but soon I was moved to a psych ward. The place wasn't specifically for eating disorder patients, but there were a couple others. First evening I struggled to eat, and the guy watching my meal just basically started yelling at me. 

Next odd thing to me was the constant surveillance which yea I get the point, but it was uncomfortable, like wherever we went there was a nurse listening and it was so awkward I guess.

I hated the ward so much, it felt like punishment more then anything. We would literally get told that ""This isn't a place to be happy, focus on your treatment"" if we were having ""too much"" fun (I mean like just laughing loudly and cracking jokes and chilling with each other)
Another specific instance was when I was having trouble eating at all and I had been refusing to drink the meal replacement thingy. A guy just starting on his shift comes in takes the drink pours it in the sink and says that I'm just wasting everyone's time.

The last thing is that no one has ever mentioned putting me in theraphy. Not even in the checkups. I mean they just make me go to some family sessions, but nothing individually for me.


I mean I don't know, maybe that all is standard, but I hated it and it didn't help me one bit. It just made me suicidal if I'm being honest.
I'm sorry that this is so long and if I'm being a dumbass. I just feel really confused about my experiences


(Hi so I'm really sorry if I didn't do this posting thing correctly I'm a bit confused)",cy2k6u,47.0,0.98,7.0,2019-08-31 23:21:22,https://www.reddit.com/r/EatingDisorders/comments/cy2k6u/request_ward_experiences/,0.0,0.0,2019.0,8.0
4,Request: How should I talk about my child's mom's eating disorder to him?," 

To give some background, I am a single dad and am no longer with my son's mom. We were in a relationship for roughly 5 years. We had a child at the end of our relationship and are working to co-parent our child. She has recieved therapy, both inpatient and outpatient, for roughly 20 years including several dozen times of inpatient and basically constant outpatient over the years.

I understand a lot about how to support recovery myself as I've gone through years of support groups, therapy sessions with her and on my own, yet I know that there is always more to learn.

My child's mom is currently in inpatient. It's not the first time since our child has been born. But our child is getting older and has some more questions (and fears) about it. The little one is roughly about school age.

How should I explain this to them? What should I tell them? How specific should I be? What should I avoid?

Our child absolutely loves mom and rightfully is concerned about her. There are questions about what this place is that she is at and whether she is sick or is going to get better.

I don't want to lie. I want to tell the truth in a way that is able to be understood. And I definitely don't want to scare.

But the truth is that this is going to be something that is lifelong. There will likely be inpatient treatment at least once a year. There will be mental health and emotional issues that will come up with her. And we will all have to deal with that together.

How do I explain this?",ctgdzy,43.0,0.96,7.0,2019-08-21 12:49:26,https://www.reddit.com/r/EatingDisorders/comments/ctgdzy/request_how_should_i_talk_about_my_childs_moms/,0.0,0.0,2019.0,8.0
5,Request: how do you deal with others' diets?,how do you cope with people around you being on a diet? i'm in college and home for the summer and my mom has severe GI issues and is on a super-strict no carb diet and barely eats throughout the day. definitely disordered eating but she just talks about how it's helping her lose weight and she needs to lose weight and the diet soooo much and then on top of that my dad will just casually mention not eating and my brothers make fat jokes. none of them know about my ED issues bc they started after i was an adult and so i can't fault them but how are you supposed to try and have healthy eating habits when everyone around you just doesn't?,cp7bpr,45.0,0.99,5.0,2019-08-12 04:17:18,https://www.reddit.com/r/EatingDisorders/comments/cp7bpr/request_how_do_you_deal_with_others_diets/,0.0,0.0,2019.0,8.0
