,Title,Post Text,ID,Score,Upvote Ratio,Total Comments,Created On,Post URL,Original Content,Saved,year,month
13,College is stupid and it makes me want to die even more,"I don’t know what the fuck is wrong with my school in particular. They never even showed me how to schedule an advisor meeting. I started out with 4 classes and had to drop two of them because I was failing (both grades below 50%) and these profs couldn’t teach if you put a gun to their heads. 

Now I have this whole English research paper to write on some bullshit topic I chose and we have to “collaborate” and “brainstorm” in class with people who are writing COMPLETELY DIFFERENT PAPERS. It’s fucking stupid. They’re not sharing my grade why should I have to ask for their help?? I keep skipping class cause I don’t want to go through that bullshit even if my grade suffers.

I think I’d be happier dropping out, living with my parents, and just working two jobs so I can focus on my side hustle. It’s just hard when my parents are immigrants and they keep telling me I’m wasting the opportunity they gave me. 

I don’t know. I just know I can’t take this shit anymore.",dmg28p,465.0,0.99,42.0,2019-10-24 13:00:33,https://www.reddit.com/r/SuicideWatch/comments/dmg28p/college_is_stupid_and_it_makes_me_want_to_die/,0.0,0.0,,
14,16M can I tell my therapist about my suicidal thoughts without him telling my parents?,"I don’t want to go to a mental hospital

Edit: I talked to my therapist and he told me he is going to tell my parents. I appreciate everyone trying to help me, but I just don’t see things getting better.",dly1a8,457.0,1.0,42.0,2019-10-23 11:41:00,https://www.reddit.com/r/SuicideWatch/comments/dly1a8/16m_can_i_tell_my_therapist_about_my_suicidal/,0.0,0.0,,
15,Im surprised with how comfortable the thought of suicide has gotten with me and it scares me.,"The thought of taking my own life has become surprisingly more comfortable/normal . It scares me. I have thought of it before but it was always "" im never going to actually do that."" But now its been cnsuming my thoughts more and more. I feel i have nothing , no one, no purpose. Im useless, i have no where to turn. The silence is deafening and the thought of taking my life just creeps up more and more and it doesnt feel so crazy anymore. This is what scares ne to se ehow my thinking has changed and maybe in a month itll be the only thing i think of. It seems im going that direction
I dont know what to really do. 
I tell nyself im being selfish and i have family that cares for me and theyll be sad but its not convincing me anymore.
i just hate how lonely i feel.
I look around and think what am i doing. Im fooling myself. I try to be happy and joke around with others. Tell myself its all in my head but i feel im losing control. 
im scared.

Edit- sorry lots of grammar and spelling errors. I'm on an old phone thats a little hard to fix",dhmz9l,443.0,1.0,26.0,2019-10-14 07:05:24,https://www.reddit.com/r/SuicideWatch/comments/dhmz9l/im_surprised_with_how_comfortable_the_thought_of/,0.0,0.0,,
0,Just called the suicide hotline,"... and was asked to please 'watch my language.'

The actual fuck.

Yea, I have a mouth on me. Yea, I have an attitude problem. But how the FUCK you going to work at a suicide hotline, even the fucking graveyard shift (heh -- suicide hotline; graveyard shift -- heh), and tell callers their language BOTHERS you? How you gonna LET that language bother you? It's WORDS, you fucking TWAT-NOZZLE. It's a HURTING HUMAN expressing herself.

Jesus fuck.",dscslu,2286.0,0.99,129.0,2019-11-06 07:11:39,https://www.reddit.com/r/SuicideWatch/comments/dscslu/just_called_the_suicide_hotline/,0.0,0.0,2018.0,10.0
1,"3 days ago was my birthday, I should’ve done it but my dog and a redditor saved my life","3 days ago was my birthday. I am getting depressed when my birthday comes since it is supposed to be a happy day, but I know that nothing special will happen.

My birthday was the worst, my friends didn’t even greet me, my boss fired up for some reason that wasn’t my fault and got mad at me, I ate alone and like nobody cares about me. I treated myself a good meal for my birthday, an Italian Spaghetti and Pepperoni Pizza. I thought of that as my last meal, and had cookies and cream ice cream for dessert. I would end it that night, or the day after tomorrow. I evaluated all the important persons in my life if I leave them. My mother would hurt, but I know she can manage. My brother doesn’t even care about me. My girlfriend is just using me since if she doesn’t have me, she’s nothing, and that’s the only reason why I haven’t left her since I know once I did that, she’ll kill herself. My “bestfriend” only talks to me when he have problems but when It is me who has problems, he’s not replying to me so I think I wouldn’t be a big loss for him. 

After hours of thinking and finally decided to do it, I remembered my dog. He would never understand what happened to me if I’d kill myself. I can’t stand the fact that he’ll wait for me to come back after a week, a month, a year, or until the day he dies because I am already dead. I cried and hugged my dog tightly. “You saved my life buddy. You’re the reason I’m still here” I said to him while he just stands there staring at me. 

After that, I just browsed reddit just today and saw something on my inbox. A stranger awarded my last post with a silver. “God loves you. Be easy on yourself.” He said to me. At that moment, I started to cry like a fucking bitch because even if I didn’t know him/her, I felt that someone hugged me and concerned about me. 

To you random redditor who gave a silver (I consider it a gold because of your kind words), I wanted to let you know that it is you who made my birthday special. I love you. 

To my dog, Bay, you’re the greatest doggo of all. Imma buy you all the treats you want. You’re the reason why I’m here. I love you so much.


EDIT: WHAT THE FUCK GUYS MY INBOX IS GETTING FLOODED WITH SUPPORT, SILVERS AND A PLATINUM. I DIDN’T EXPECT THAT. I NEVER FELT LOVED LIKE THIS BEFORE. TO ALL WHO MESSAGED ME SAYING THAT THEY ARE GLAD THAT I’M STILL HERE, THANK YOU SO MUCH. ALSO THOSE PEOPLE WHO COMMENTED ON THIS POST. I CAN’T REPLY TO YOU ALL ONE BY ONE BUT THANK YOU SO MUCH. IMMA LET MY DOG KNOW THAT HE GOT SO MUCH RECOGNITION FOR BEING SUCH A GOOD BOI. THANK YOU SO MUCH STRANGERS WHO MADE ME FELT THAT THEY LOVE ME AND CARE FOR ME SO MUCH. I LOVE YOU!!!!!!! ❤️❤️❤️",dub69m,1194.0,0.99,87.0,2019-11-10 13:03:53,https://www.reddit.com/r/SuicideWatch/comments/dub69m/3_days_ago_was_my_birthday_i_shouldve_done_it_but/,0.0,0.0,2018.0,10.0
2,"The reason I love my bed and sleeping so much is because it’s the closest to death I can get for now, it’s like a free trial",,e05a1k,1037.0,0.99,77.0,2019-11-22 18:43:55,https://www.reddit.com/r/SuicideWatch/comments/e05a1k/the_reason_i_love_my_bed_and_sleeping_so_much_is/,0.0,0.0,2018.0,10.0
3,"Anyone ever lie in bed at night and think to yourself, “I could end it all right now with this (knife, gun, pills, etc)?”","I’ve come quite close to trying it, but I don’t have the courage to do so.",dyc4yh,875.0,0.99,129.0,2019-11-19 00:09:46,https://www.reddit.com/r/SuicideWatch/comments/dyc4yh/anyone_ever_lie_in_bed_at_night_and_think_to/,0.0,0.0,,
4,The only reason I haven't killed myself is because I'm scared of not knowing what death is.,,dxkhm6,765.0,0.99,91.0,2019-11-17 09:19:53,https://www.reddit.com/r/SuicideWatch/comments/dxkhm6/the_only_reason_i_havent_killed_myself_is_because/,0.0,0.0,,
5,Do you ever go to sleep early wishing you never wake up?,"I have been doing that every night for the past weeks, I try to sleep early thinking and wishing that will be the last time I will be awake.",ds4ila,743.0,0.99,62.0,2019-11-05 19:51:47,https://www.reddit.com/r/SuicideWatch/comments/ds4ila/do_you_ever_go_to_sleep_early_wishing_you_never/,0.0,0.0,,
6,Why does living with depression just feel like a series of necessary distractions?,"Every single damn day I have to find at least one thing to distract me from the fact that I want to die. 

I don't want to hurt.  I don't want to suffer. I don't want to take anyone with me in the process.

I don't want to fail at it and end up with some kind of neurological issue or permament physical injury. 

I don't want to hurt the ones who care about me, either.  Like my parents. I love them. 


But I am just so damn tired of living.  It would be so nice if I could just fall asleep and not wake up.  

How nice it must be to not have depression. To not want to die.  I can't imagine how nice it must be going a day without fighting my own self...",dt7ns0,680.0,1.0,34.0,2019-11-08 01:05:42,https://www.reddit.com/r/SuicideWatch/comments/dt7ns0/why_does_living_with_depression_just_feel_like_a/,0.0,0.0,,
7,"I'm 15 years old, I will kill myself next week. I need help. I need to feel that somebody understands me.","Hi, for the people worrying, I have made a post with an update, I am so thankful for your support I love you all:
https://www.reddit.com/r/SuicideWatch/comments/e22l0a/update_im_15_years_old_i_will_kill_myself_next/?utm_medium=android_app&utm_source=share

Please trust me, I am trying to describe my feelings in this post for almost 3 hours now. I need to post this. I will edit this tomorrow and do a whole story I just need somebody to know this. I don't want to die.",e13h41,651.0,0.99,117.0,2019-11-24 19:44:48,https://www.reddit.com/r/SuicideWatch/comments/e13h41/im_15_years_old_i_will_kill_myself_next_week_i/,0.0,0.0,,
8,I wish there was a reset button for life.,I wish,dwrjig,627.0,1.0,60.0,2019-11-15 14:30:47,https://www.reddit.com/r/SuicideWatch/comments/dwrjig/i_wish_there_was_a_reset_button_for_life/,0.0,0.0,,
9,I told my mom for the first time that I tried to commit suicide,"She yelled at me, then I told her that I'm sure I have depression, she doesn't believe and I can't stop crying.",dz9w45,608.0,0.99,78.0,2019-11-20 23:04:36,https://www.reddit.com/r/SuicideWatch/comments/dz9w45/i_told_my_mom_for_the_first_time_that_i_tried_to/,0.0,0.0,,
10,i almost killed myself,"but i didn’t. 

yay? i guess?

i almost drove off the cliff. i was so close to doing it. but i sat in my car and i screamed, 

“JUST GO HOME. JUST GO HOME. JUST GO HOME. JUST GO HOME.”

until i made it home. and then i sat in my driveway and sobbed.

when i went inside, i broke down in front of my roommates and had a severe panic attack and my roommate just rubbed my back and helped me breath.

the next day, my best friend took me out to eat. i told her i almost did it. and she said “i could tell a few days before that you were off. and i didn’t say anything. i’m sorry, i should have. i didn’t want you to feel like i was smothering you.” 

but it just meant a lot that she noticed and that i could talk to her about it. 

i have a great support system, but i’m just living with this mental illness. it hurts. my life is so good, but i’m just sick.",dx1zrl,603.0,0.99,29.0,2019-11-16 04:08:00,https://www.reddit.com/r/SuicideWatch/comments/dx1zrl/i_almost_killed_myself/,0.0,0.0,,
11,If only dying were as simple as pressing “shut down” like on a computer,"So many years of pain I wouldn’t have to have lived through, so many more years I won’t have to be put through,

Jesus Christ someone please just stop it all for me.",e3rxll,550.0,1.0,35.0,2019-11-30 06:31:24,https://www.reddit.com/r/SuicideWatch/comments/e3rxll/if_only_dying_were_as_simple_as_pressing_shut/,0.0,0.0,,
12,Do you ever just want to talk to someone about your suicidal feelings but then anxiety grabs you by the throat and chokes you until you have a breakdown?,"I’m autistic so I’m very prone to the classic ‘autistic meltdowns’. I feel like my condition stops me from being happy and normal, instead I’m viewed as very weird and obsessive.

People in the past have scared me enough to barely talk verbally nowadays. I know if I were normal, I’d be happy and successful. No one will accept that my condition has made me a failure.

Yet I can’t talk about it to anyone about this, I just end up exploding and then overdose on my sleeping meds (nowhere near enough to kill me, but enough to knock me out pretty fucking hard).

I dunno, I’m a mess tbh! :)",dxbjnh,540.0,0.99,26.0,2019-11-16 19:40:59,https://www.reddit.com/r/SuicideWatch/comments/dxbjnh/do_you_ever_just_want_to_talk_to_someone_about/,0.0,0.0,,
13,I wish boys were allowed to be feminine without being judged.,"I’m a feminine guy and I just want to express it when I’m at school. The judgement that I get is too much to bear and the only thing that I can get away with is a flower in my hair, and even then I get a few insults hurled at me. I would do much more if I wasn’t judged. I can’t express who I am to the world and have to bottle it up.

I fucking hate this. This is just a minor point in the many reasons I just want to kill myself.",dukigb,482.0,0.96,56.0,2019-11-11 00:55:10,https://www.reddit.com/r/SuicideWatch/comments/dukigb/i_wish_boys_were_allowed_to_be_feminine_without/,0.0,0.0,,
14,This will get lost in a sea of Suicide notes,"I’m using this to say exactly how I feel cause I know no one will see this. 

The last time I was genuinely happy was when I was 5.. then my grandfather died. I was extremely close to him and after his death things just weren’t the same, fast forward to 7th grade my father whom I was never close to despite living in the same house decided to slowly leave his family for another family and left my mom and I alone, then my mother took him back which kissed me off and caused me to an angry child who didn’t trust anyone... which probably caused me to never have a real relationship cause I never feel good enough and I can never fully trust them. Anyways I was always socially awkward/ shy and didn’t have a lot of friends but I have 3 childhood best friends I can at least say I have but as we’ve gotten older and everyone is moving on with their lives I feel stuck. 

My life began to really fall apart in the fall of 2017 ( my second year of college) when I began to rapidly lose the vision in my left eye due to a condition I have that I didn’t even know about until the year before but the doctors said I shouldn’t worry to much about it, due to the loss of my vision in that eye I had 2 eye surgeries to try and repair it but they didn’t work which shocked the doctors. I took a semester off of school to recover and came back in hopes to finish school, then in February of this year the vision in my right eye began to slowly go away. I had to quit my job and leave school and move back in with my parents to try to “ heal”..

I eventually got a job ( which I hate with a passion) and became stuck... then I got into a car accident and totaled my car so now I’m carless. I want to go back to school and get a new car but I feel like what’s the point if I won’t be able to see in a few months, everyday when I wake up before I open my eyes I think “ am I going to be able to even see”. It sucks because surgery won’t work, I’ve tried the holistic approach too and I’m still just slowly losing my sight. I really took things like that for granted.  My parents put me in therapy and it has caused me to face things but with my looking at the bigger picture I’m like what’s really the point? 


I’ll have 3 days of me feeling like myself and”happy” then it’ll be weeks of me in a deep depression wanting to kill my self or hoping I’ll die. I told my mother I want to kill myself before I go completely blind because I couldn’t live like that ( respect to those that are blind and live cause y’all are strong.. even though y’all can’t see this) so I said I’m going to see how the rest of the year plays out cause I’m not going into 2020 like this, but it’s like when I try to get my shit together nothing goes right, I had my heart set out for this new job and everyone there was like you got the job, the supervisors liked you, the employees recommended you, etc... no call back ( I was supposed to get one yesterday if I got the job) that was my breaking point. 

That job really was a push for me to keep going but now that I didn’t get it I feel stuck again, I feel like I sound stupid and dramatic and I know this is worded horribly but I guess I’m just writing my jumbled thoughts out. I’ve been looking up easy ways to kill myself but I’ve seen that there are none... if I had a gun I’d just shoot myself, I looked up ODing on pills but it’s hit or miss and the miss will fuck you up, I thought about hanging myself but I’m black and I’d feel weird idk lol, I think about driving into oncoming traffic and hoping I’ll die but I don’t want to total my dads car cause that’s his property, I thought about cutting myself but I’ve read that that’s a slow death. 

It’s like why is it so hard to die when you want to but when life is going good then you get sick, or die, etc. I guess I sound like a bitch cause I want to die but I don’t want to feel any pain but I guess I’ll have to feel pain in the process cause afterwards they’ll be no more pain. There’s like so much going on in my head and so much to write but idek what to say tbh even though I already said a lot, all in all I’m just so tired. Tired of crying myself to sleep, crying to work, crying at work, crying alone at home, and crying myself to sleep. I’ve been trying to disconnect myself from people but it’s like I still crave human interaction that’s why I feel like a fraud cause I want to be alone but I don’t to feel alone. 

This whole thing probably doesn’t even make any sense but I’m just writing out my thoughts. No one will see this anyways or even read all of this anyways. At first I was giving myself till the end of the year but now I’m just trying to find the best method to end it.",e0h3wr,472.0,1.0,40.0,2019-11-23 12:11:54,https://www.reddit.com/r/SuicideWatch/comments/e0h3wr/this_will_get_lost_in_a_sea_of_suicide_notes/,0.0,0.0,,
15,It just costs too much to live,"I can’t handle poverty any more. Everything is too expensive. I’m afraid to use my heat this winter because the electric bill would be too much. I have a radiator and a pile of blankets, but if I don’t run the heat the pipes will freeze and I can’t pay to fix that if they burst. 

I don’t wanna live because all I do is pay bills. There’s no enjoyment in my life, just constant stress and worry and fear that I’ll end up homeless. 

Everything is a struggle. I have to strategically be late on certain bills so the service doesn’t get shut off but I can pay one thing while I neglect another. Interest on my loans and credit cards makes it so I don’t seem to make progress paying anything back. 

I just can’t take it anymore.",dqjp34,448.0,1.0,51.0,2019-11-02 12:49:14,https://www.reddit.com/r/SuicideWatch/comments/dqjp34/it_just_costs_too_much_to_live/,0.0,0.0,,
0,Raped in front of my girlfriend. feeling like giving up.," 

I don't know what to say or do, I just feel like my life is falling apart.

Three weeks ago My apartment was broken into by 4 strangers, my girlfriend was sleeping over. It was an awful, horrific long night, and she witnessed every single thing. 8 hours of prolonged humiliation and abuse.

These 4 strangers destroyed me. They shredded every bit of self-esteem and sanity I had. After the hell they put me through, they simply left me there. bleeding heavily and stunned. My girlfriend was tied up screaming, but I didn't move. It took me a while to comprehend that this is now my reality and eventually get up.

Weeks later, I am paranoid, unable to look at my reflection without feeling disgust, and I spend my time in my university lectures thinking about ending my life. I didn't tell a single soul about this because I feel so ashamed. I feel pathetic and weak. My girlfriend is the only one that knows, though everyone around has been telling me I've been ignoring them lately and calling me an asshole for it, yet I don't care. I just feel numb. I want to die, but I'm too afraid to say it out loud. That night they not only violently violated me, but they took something from me, a piece of my soul.

Anyways, ever since that night my girlfriend has been acting different. she treats me differently, touches me differently, and most importantly she looks at me differently. A few days ago while we were sitting together, she told me that it's alright if this experience turns me ""gay"" and that we don't have to continue dating. this is coming from a 19 year old girl that has common sense, it all just made me feel really bad. It just reflected how after all this, how disgusting I feel was valid, that I am gross in her eyes now.

Today is my birthday, I turn 20. I bailed on all the plans and decided to spend it alone. I'm sitting at home drinking alcohol and thinking about bashing my goddamn face in. I just feel alone in a way I never felt before. I just never thought this is where I'd be, that this would be my life.

I hope I'm posting this in the correct place, I've only had Reddit when I was younger. thanks for listening for whoever is out there. Hopefully I'll feel better for writing this.

UPDATE 1:
Two of the assailants were caught by the police today. I’ll post a more detailed update in the next few days. 
Thank you everyone for this support.

UPDATE 2:
sorry I’m late with this, I’ve just been going through a lot. I’m gonna try to give everyone a bit of closure on everything that’s went down. 
The four assailants were part of a sex trafficking gang that my shitty dad got involved with and owed a lot of money. I’m not comfortable sharing the details of this specific aspect, but I hope this general explanation is enough. 
Two of them were caught and will be most likely going to prison as they plead guilty to avoid a trial. 
I’m currently trying to get myself together, but things have been getting worse and worse mentally. I’ve been going to gym, jogging and trying my best to not lose it, I didn’t start therapy, but I’m considering it. 

Me and my girlfriend broke up and there’s no bad blood. I just need to focus on myself. 

And again, thank you everyone for the immense support you’ve given me. You have no idea how much it saved me and made me feel a little less alone. Thank you.",e8gjky,2825.0,0.99,350.0,2019-12-09 21:41:43,https://www.reddit.com/r/SuicideWatch/comments/e8gjky/raped_in_front_of_my_girlfriend_feeling_like/,0.0,0.0,2018.0,12.0
