,Title,Post Text,ID,Score,Upvote Ratio,Total Comments,Created On,Post URL,Original Content,Saved,year,month
16,I HATE THIS WORLD SO FUCKING MUCH! EVERYONE HELPS ONLY THOSE WHO LEAST NEED IT! THE POOR GROW POORER AND THE RICH GET RICHER! FUCK THIS!,,caxs3n,555.0,0.94,68.0,2019-07-09 07:51:10,https://www.reddit.com/r/SuicideWatch/comments/caxs3n/i_hate_this_world_so_fucking_much_everyone_helps/,0.0,0.0,2019.0,7.0
17,Its amazing how people act so attention-seekingly on social media when people die. Its one of the reasons i wont kill myself.,"The subject speaks for itself really. I just cant get over how so many f\*\*\*ing worthless maggots would try to make my suicide a big  deal for them. Even in the face of the fact that none of them have have even cared the slightest bit about me or my wellbeing.

F\*\*\* those people",cdrnxz,534.0,0.99,38.0,2019-07-16 03:21:56,https://www.reddit.com/r/SuicideWatch/comments/cdrnxz/its_amazing_how_people_act_so_attentionseekingly/,0.0,0.0,2019.0,7.0
18,Does anyone else have visual thoughts of their suicide?,"I have suicidal thoughts daily and visualizations of killing myself for the past 6-7 years (I am 21)
They're not really intentional just a reaction to the deep pain and stress I go through every single day of my life. It's a shitty learned hopelessness coping mechanism I've created to cope everytime something bad happens I can just see it",ca4ytp,534.0,0.99,62.0,2019-07-07 09:16:13,https://www.reddit.com/r/SuicideWatch/comments/ca4ytp/does_anyone_else_have_visual_thoughts_of_their/,0.0,0.0,2019.0,7.0
19,"In twenty six days, I am throwing a moving away party. I don't have the heart to tell my friends I am thinking about taking my life shortly afterwards rather than go through with my move.","It's strange to me how happy I feel now that I've picked the date. I feel at peace with the idea, but I haven't made any specific plans yet on the method.  


The reasons why I'm suicidal and why I'm moving are really similar. I feel so broken and tired. I've battled mental illness for 12 of the 24 years I've been alive. It's really drained me and robbed me of my full potential. Whenever I seem to find a little bit of calm in between big storms, things come crashing down. 

I'm a high functioning depressed person. I have an active social life. I have a good job. I have some good hobbies. I try to see a therapist and take medication. But deep down, there's a lot of darkness I carry. Nobody knows at work that I constantly question how I should take my life everyday, or if life is worth living. It's the first thought through my head when I wake up. When I've tried to open up to people, they treat me like I'm a burden or a liability. I feel so trapped in a persona that I've built for myself - I put up a facade of a happy and energetic person. I decided to set a date to move to leave everything behind and start a new life. But the big secret I carry is I don't want to start over.

I've really struggled. I've taken countless meds, I've seen a therapist for over three years. I've learned to lie to my boss or people close to me about how I've been feeling. I'm really tired. I tried to kill myself when I was 12 and got hospitalized. I thought that was a low point I would rebuild from. Six years later, when I was 18, my girlfriend hung herself. This year, I got diagnosed with bipolar II. I'm sick of countless crazy side effects from these psychiatric drugs. I don't want to keep having to try to fight this for the rest of my life.

So in 26 days, my friends will all get together for one last party. They'll say their goodbyes, and they'll make peace with not seeing me again for a long time. I think this is the time I'm going to do this. I could move 800 miles away, but that only brings me opportunity to just get hurt again. I don't want to live anymore. I love the people in my life so much, but I can't carry this anymore. I want to die so badly.  


I know this will break some people close to me. That tears me up so bad. But in the end, this is something I need to do for myself.",ca9qp2,527.0,1.0,49.0,2019-07-07 17:58:36,https://www.reddit.com/r/SuicideWatch/comments/ca9qp2/in_twenty_six_days_i_am_throwing_a_moving_away/,0.0,0.0,2019.0,7.0
20,Does anyone else just wish someone would come up behind them and just shoot them in the head?,"I want to die so beyond badly, but I dont have the courage to do it myself. I'm afraid of failing, becoming brain dead, becoming paralyzed, getting committed and losing my job, my boyfriend... I just wish someone would do it quick for me this way I wouldn't be scared or nervous about it. Itd just finally be over. I'm such a coward...",ce1hok,522.0,0.99,76.0,2019-07-16 19:07:44,https://www.reddit.com/r/SuicideWatch/comments/ce1hok/does_anyone_else_just_wish_someone_would_come_up/,0.0,0.0,2019.0,7.0
21,My sister told me to kill myself (part 2),"Part 1 (Read first): [https://www.reddit.com/r/SuicideWatch/comments/cd8n23/my\_sister\_told\_me\_to\_kill\_myself/](https://www.reddit.com/r/SuicideWatch/comments/cd8n23/my_sister_told_me_to_kill_myself/)

Edit- Part 3: [https://www.reddit.com/r/SuicideWatch/comments/cjl0ro/my\_sister\_told\_me\_to\_kill\_myself\_part\_3/](https://www.reddit.com/r/SuicideWatch/comments/cjl0ro/my_sister_told_me_to_kill_myself_part_3/)

My sister, later that day, *did* apologize (because mom told her to) but it seemed as if she wasn't even sorry. Her ""apology"" wasn't even sincere. She was laughing, looking away, rolling her eyes, as if the whole thing was a fucking joke.

My mom told the both of us that the situation between us has gotten way out of hand, and wants to do family counseling. My sister started arguing with mom, saying how she doesn't want to make up with me.

So I asked my sister, ""Why are you mad at me?""

Of course, she didn't answer and ignored my question. I asked over and over again, but she didn't answer it.

The next day, I told my therapist that I tried to kill myself and she told me that I had to tell my mom. I told her, and she burst into tears. I also told her about all the hurtful things my sister said to me over the years.

Mom: Why didn't you tell me any of this?

Me: I thought you wouldn't believe me, because you and dad always knew her as a nice person.

Eventually, we had to tell dad about what happened. And for the first time, he cried. I've never seen him cry before. And it broke my heart to see my parents like this.

My mom scheduled a session with my therapist on 7/29/19 *with* my sister. But I'm worried that my sister will start lying to my therapist and will try to manipulate her to make it seem like everything was my fault. But my therapist says that she is trained to not fall for that, since she knows my side of the story.

I was told that her boss was going to be there, too, because she's only involved in a session if it involves *serious* cases, such as suicide.

Edit: Thanks for the silver!",cgh5nz,513.0,0.99,49.0,2019-07-22 18:41:47,https://www.reddit.com/r/SuicideWatch/comments/cgh5nz/my_sister_told_me_to_kill_myself_part_2/,0.0,0.0,2019.0,7.0
22,Finally stopped— pet cat was the solution,I got a cat. I’m focusing on my company now and stopped trying to trade. The cat brings me so much peace of mind I’m so in love with it. However my dad hates pets and he’s trying to make me get rid of him. I’m so sad I can’t imagine losing him he sleeps on my lap while I work or lays on my desk. I love it so much,cidnxs,512.0,1.0,29.0,2019-07-27 05:29:41,https://www.reddit.com/r/SuicideWatch/comments/cidnxs/finally_stopped_pet_cat_was_the_solution/,0.0,0.0,2019.0,7.0
23,"I told my mom I'm suicidal, she forgot.","A few weeks ago I was doing a few chores with her when I broke down and told her that I hated life and that all I ever did when I woke is wishing something would kill that day because I'm not brave enough to do it myself, she called me ungrateful and I snapped and slapped her (It was wrong and I did apologize after it) she cried and that's where it ended. Today I broke down again and told her I needed help, she told me that I can talk to her whenever I want to Wich I answered ""Don't you remember what happened the last time we talked?"" She said that she did remember, that she remember how I slapped her, when I asked her if she remembers why I did and what we were talking about a that moment she just shrugged her shoulders and asked ""What were we talking about""

I'm crushed and seriously in danger of trying to commit suicide again, if my mom doesn't even remember that her own son wants to kill himself then she obviously doesn't care enough and if she doesn't, who does? I'm just a waste anyways.",chvc2a,491.0,0.99,37.0,2019-07-25 23:39:59,https://www.reddit.com/r/SuicideWatch/comments/chvc2a/i_told_my_mom_im_suicidal_she_forgot/,0.0,0.0,2019.0,7.0
24,Hi i went from 100% certain i want to kill myself to not knowing what to do... I guess its an improvement? Thanks ya all that helped i would be dead by now if it wasn't for you all... Im looking forward to seeing what the future will bring... Cheers on ya all!!🥰,,ca0ydf,471.0,0.99,34.0,2019-07-07 00:46:20,https://www.reddit.com/r/SuicideWatch/comments/ca0ydf/hi_i_went_from_100_certain_i_want_to_kill_myself/,0.0,0.0,2019.0,7.0
0,"Does anyone else have this really destructive pattern of feeling suicidal and ruining everything in your life because you think you won’t be around to deal with it, only to fail or not even attempt suicide and have to try to pick up the pieces?",,coxe4f,1510.0,1.0,69.0,2019-08-11 14:31:04,https://www.reddit.com/r/SuicideWatch/comments/coxe4f/does_anyone_else_have_this_really_destructive/,0.0,0.0,2019.0,8.0
1,Chocolate saved my life,"My last serious suicide attempt was in July 2018. I had booked a hotel in a nearby city for two days for ''a conference'' and randomly packed up so it wouldn't be suspicious to my mom. I didn't want to do it in my room because in a way I didn't want to defile it? I don't know how to explain it. 
My plan was to do it as soon as I got to the hotel because thinking about it and postponing makes it more difficult and I wanted to make sure nothing would stop me. 
I opened my suitcase to grab my toiletries bag that had my pills but when I opened the suitcase, something dropped on the floor. It was my favorite chocolate, 70% dark cocoa with candied orange bits. It had a little heart sticker sticked on the wrapper. My heart dropped and I couldn't stop crying. Eventually I think I fell asleep on the floor holding the chocolate and when I woke up, I felt something I hadn't felt in years. I felt loved. My mom put that chocolate there to surprise me because she knows how sometimes I'll forget to eat when I'm overworked. 
Just wanted to share that with you because I could really use that chocolate today. I really could.",cwpqz4,1440.0,1.0,66.0,2019-08-28 19:43:20,https://www.reddit.com/r/SuicideWatch/comments/cwpqz4/chocolate_saved_my_life/,0.0,0.0,2019.0,8.0
2,No one cares about your life until you say you want to end it,,cubxv2,1246.0,1.0,113.0,2019-08-23 10:21:01,https://www.reddit.com/r/SuicideWatch/comments/cubxv2/no_one_cares_about_your_life_until_you_say_you/,0.0,0.0,2019.0,8.0
3,"I’m absolutely annoyed whenever I comment something suicidal and random people just tell me “call the national suicide prevention hotline” , I actually want people that I can relate my problems with, I don’t want a fucking hotline that doesn’t do shit.",,cuiinz,932.0,0.99,89.0,2019-08-23 19:18:59,https://www.reddit.com/r/SuicideWatch/comments/cuiinz/im_absolutely_annoyed_whenever_i_comment/,0.0,0.0,2019.0,8.0
4,"Does anyone see weddings and instantly think: ""That's never gonna happen for me""",,ctz0mq,907.0,0.99,116.0,2019-08-22 15:30:07,https://www.reddit.com/r/SuicideWatch/comments/ctz0mq/does_anyone_see_weddings_and_instantly_think/,0.0,0.0,2019.0,8.0
5,Do you feel like a useless NPC ?,"Like a joke character , no one interacts with and always 
alone no one gives a fuck about him .",cvlaht,903.0,0.99,85.0,2019-08-26 08:35:55,https://www.reddit.com/r/SuicideWatch/comments/cvlaht/do_you_feel_like_a_useless_npc/,0.0,0.0,2019.0,8.0
6,Do y’all’s ever want to kill yourself over a minor inconvenience and that makes you want to kill yourself even more cause other people have it way worse?,"Like, I’m reading posts on this sub where people’s siblings/loved ones have killed themselves and they want to follow, that one guy was a pedophile, people are extremely lonely/ugly/poor/abused, and it’s just an overall Shit show.

I dropped like 5 dishes at work today and that was enough to almost make me go over the edge. There are literally slaves that have known nothing but agony their entire lives in this world and I’m just your average clumsy 18 year old who, in the grand scheme of things, has nothing to be worried about. Fuck.",clpk56,843.0,0.99,34.0,2019-08-03 23:42:56,https://www.reddit.com/r/SuicideWatch/comments/clpk56/do_yalls_ever_want_to_kill_yourself_over_a_minor/,0.0,0.0,2019.0,8.0
7,"My name is Tyler, that’s my real name this is my only account, I’m highly suicidal, have been since I was about 6-7 years old, I’m 26 now and it’s different now. I’m going to tell you my story in a new attempt to gain enough relief to fall asleep tonight. Thanks for reading if you do <3","
Growing up, I was always a really weird kid. I distinctly remember that I had just seen the world differently. It seemed that my imagination had a bigger play in my life than most. Me and a friend in kind garden would squeeze batteries in our hands and pretend that we were Mario or Pokémon because neither of our families could/would buy us a game console but we were exposed to them by relatives and tv. It was so simple back then and looking back so pure,  but it felt like we were there. We didn’t have what other kids had to have fun so we became those things. As far as I know I was a decent enough kid however when my brother came along around age 4, we would fight, I would hurt him, not bad (typically young brother bs) but still enough to get beaten from my father when he got off work. My father more so was (he is still with us) a rigid, traditionally Hispanic in parenting, angry, regretful person. When he was in the house there was always a strange energy of danger even if nothing was going on. It was better to just stay quiet. This didn’t really work because my younger brother soon learned that it was an easy win when we’d bicker to just cry out loud, our dad would come in, beat my ass and I would curse my brothers name for doing so but alas it would get me to stop. My real last memory of child abuse before my teens is about 15 seconds of my dad putting me in a corner on the ground, telling me if I wanted to fight to put my hands up and when I did to just shield myself he pummeled me with closed fists. I was around 10 years old, maybe give or take a couple years, not sure, I have terrible memory of most my life. As I got older, my brother and I actually started bonding, he liked the way I started standing up to our dad no matter how bad I was beat down. He’s told me i inspired him. My mom btw is/was awesome, but didn’t really do much except yell to stop from the sidelines or leave the room since she couldn’t bear to watch. I can’t blame her, not much negativity felt towards her for I know she unconditionally loves me and that must’ve been a tough and traumatic experience for her as well. Moving forward, I’m a decent student, normally averaging around low A’s my brothers straight A’s if not 100’s, not much of a big deal there, my mom started adding incentives once we grew into our early teens (for every A we got in a semester she’d give us like 10 dollars or something, it was dope so we did well). Through out life I feel like I found connections that I would replace for my fathers love, through friendship. I grew very close and desperately wanted to fit in with my friends. I would spend hours out of the house riding bikes around the neighborhood doing dumb lil kid shit, but it was a really freeing time out I remember. Fast forward, around when I was 14, my brother 11 my mom bought me a bass guitar because I had been getting into random enough Japanese rock from the anime I would watch and to me the bassist was always the most bad ass and going crazy member, my brother came along and she bought him a guitar spur of the moment, figured it would help us bond. It did. It really did and I thank everything in this world for those times that followed because they were hands down the best years of my life. I was a shitty bassist and soon transitioned over to wanting to be a singer and my brother excelled at guitar, going onto be called a prodigy by everyone from teachers, producers and most of the respected music industry people we would eventually encounter. But at the time he was my little brother and being a fresh teen thought it would be wack to have my 11 year old brother in the band. I started a couple bands, the second one introducing my brother in as lead guitar. This was a turning point.

Back to family life, my dad started to realize he was aging and I was starting to gain my testosterone fueled teenage body, this didn’t stop anything, but only extended our fights into actual fights. My dad, a correction officer, doing manual labor his whole life handed my ass to me every time. All while telling me to kill myself and how no one loved me and I was a mistake. Nothing like this was said to my brother, unless in terms of how I’ve manipulated him into becoming just like me. I became a bit of a shitty protector of the house hold, two accounts stick out immeasurably to me. The first being (funny kind of a call back to how my brother would yell for my dad to come) my brother was upstairs and screamed Tyler help dad just hit me. In a blind fury, i bum rushed my dad onto the floor, commanded my brother to hold his arms down and pummeled him in his face, chest, balls, anywhere i could hit before he brother free all while yelling the likes of “it used to just be me, that’s where you should’ve left it”. It was a powerful moment. My father spent the rest of the week walking downstairs like a caged tiger screaming and laughing about how he was going to kill me. ‘‘Twas still a sweet victory. No fear.

I’ll speed up the rest: me and my bro made a band, everyone betrayed us, we made another and took full control of who was in it, wrote all the music, what we looked like, who we recorded with, and what not. With his help i created a two year plan to get signed to a label called Fearless Records. We played metal. It was therapeutic and empowering stuff to play after everything you’ve read thus far. 

We did it in four months.

I got a text by our newly acquired manager that we had been offered a deal by the label of our dreams. I cried and got sent home early. A record that I wrote all the lyrics to and my brother wrote all the music to, all fueled by the hate and distinction of our father son dissonance. It was the biggest victory a small town probably has seen, at least our small town. Every time he said we were garbage, we should try something else, i couldn’t sing and my brother should play something nice. Every time he laid a hand on us, put into songs and we did it in four months! Still makes me proud to this day man. 

Btw, this isn’t a story about my father.
He is not the reason I want to kill myself anymore.

The label fucked us over, made us record 3 different records each time hating something that they previously wanted and we called it quits. Our deal was good n no need to recoup anything, just disband.

This is where whatever is inside me to this day was brought into this life. A foe I don’t know if I can beat this time. Throughout the story so far, I had a flame inside of me. The whole time a purpose to prove. A will to fight. I always told people that I wasn’t sad, I was angry. And the anger forged who I was. A determined, skill ful musician, with the mane of a lion and the attitude to match, a man who did it. But when that all went away. I became a worm, but not yet.

Shit with my dad cooled off, he retired. I’m assuming his job really was the culprit of the aggression and I stopped holding the past against him. At this point I had been a dumbass at points too and figured it was not worth the energy or the negativity of keeping that cloud around. Was he still an incredibly ill informed, ego centric prick? Yeah, but I was a different person now and couldn’t be bothered with it. Most times shrugging off his comments. I had worth now.

Me and my bro made another band with just our drummer from the previously signed act, but it didn’t last long, we did an all over the place EP that was uninspiring yet everyone we showed loved it. Drummer left, became a solo artist, he’s a whole other story. I can’t help but feel as tho I’m responsible for his and my brothers mental state as I’m 3-4 years older than both of them (i was always the dad figure to them).

Fuck it tho, rock n roll, we did it once we’ll do it again. Me and my brother move to Los Angeles California in hopes of creating a new sound within the fusion realm of rap, emo, metal, and pop genres. We moved with two of my friends from NY and got a shitty two bedroom apartment and split the rooms. The other two room mates were supposedly friends for years yet fought constantly, shit talked each other and created this crazy negative space in this 1000 sqft. It was not comfortable to say the least. However the one room mate in specific, targeted my brother, who at this point basically didn’t talk to either of them. (This is point one and point 2 is my confesssion) And then there was me, i had developed an alcohol problem, not that i drank every day or even every weekend. But when i did, i became a different person, i would usuallly drink myself to sleep as well. My brother picked me up from a bar one night and while on his way i began to get robbed. I refused it and tried to buy time and ended up running to his car when he got there. Amped on on about 10 jack n cokes and the adrenaline of potentially dying, i flipped shit on my brother. Cursing him out, saying i didn’t need him, i could pay someone 20 dollars to do what he does, etc. it was awful. And it was the last straw for him. Within the next week or so he packed up, quit his job and went back home. 

I was heartbroken, but covered it up with anger. My other two room mates, if you can believe it, convinced me that i didn’t need him and that he held me back. I thought I’d be okay and he’d come back, i left our room exactly how he left it for months. He didn’t. 

This was the final nail in the coffin for my mental state to date. I spend every night analyzing the past, and i think I’ve learned that at first i created a whole identity to hating my father, then after that i created a whole identity around me and my brothers music career and once he was gone and to this second of typing it, I’m lost. I don’t know what to do. My personality feels like it’s splitting. Some days I’m this really cool extroverted ladies man guy and some days I’m a worm in my bed spending money he doesn’t have on post mates so he doesn’t have to leave the apartment. When i sit down and try to write music, i can, but i don’t feel it anymore. It’s the only skill i have. I didn’t go to a real college because of the deal, I’m not good at anything and I’m not interested in anything other than music. But there’s no inspiration left in me. Nothing really makes me happy anymore. I had a gf, nothing, broke up with her, nothing i have a new one, i miss her sometimes but for the most part nothing, i have written 6 new songs, nothing, i post a photo on Instagram, nothing, i go to work, nothing, i watch a movie, nothing. Everything just seems so pointless now, i don’t see myself as the star i once did. I don’t even believe myself when i sing, or have conversation with people. It’s like I’m watching the most boring movie about someone that i just don’t even care about. I just want him to die. I just want to stop wondering and working and fighting, i don’t want to do it anymore, and i was the relief of death. 

Idk what i expect from this but it was slightly therapeutic, thanks for listening.",cwio6u,788.0,0.99,45.0,2019-08-28 10:02:26,https://www.reddit.com/r/SuicideWatch/comments/cwio6u/my_name_is_tyler_thats_my_real_name_this_is_my/,0.0,0.0,2019.0,8.0
8,Being born ugly sets you up to fail,"They say looks don’t matter, but unfortunately that isn’t true. For some of us, the amount of grooming, styling and exercising we do just can’t fix bad genes. While adults may not judge someone on face value if they are unattractive, being made fun of as a kid leads to a chain of effects

Get made fun for appearance as a kid/teen...

Don’t have anyone to hang with...

Shattered confidence...

Staying home on weekends and not talking much during school...

Not developing social skills...

Being socially inept as an adult

Most of my quirks are in my bone structure so it would take some serious plastic surgery to address them. I’m so angry at myself for skipping on an opportunity to fix a very big flaw with my appearance 5 years ago because some yes-men convinced me I was okay. I’m not.",cw8rx4,726.0,0.99,111.0,2019-08-27 18:53:10,https://www.reddit.com/r/SuicideWatch/comments/cw8rx4/being_born_ugly_sets_you_up_to_fail/,0.0,0.0,2019.0,8.0
9,"well guys, i’m alive",i stayed up the whole night last night going back and forth with my bottle of pills. i guess i won.,cv9yc5,697.0,0.99,89.0,2019-08-25 15:35:28,https://www.reddit.com/r/SuicideWatch/comments/cv9yc5/well_guys_im_alive/,0.0,0.0,2019.0,8.0
