,Title,Post Text,ID,Score,Upvote Ratio,Total Comments,Created On,Post URL,Original Content,Saved,year,month
0,"Just called suicide hotline. Thanks, Tom.","I called the suicide hotline because I’ve been sad for a long time. Had enough norco to overdose and almost did. Instead, I called a suicide hotline and was connected with Tom. He coached cross country. I run cross country and track for my university. He said he is now a fan of my team and will watch for my name on the leaderboards. Thanks for giving me even the slightest reason to keep going, Tom. ",7opdab,1183.0,0.99,27.0,2018-01-07 07:40:41,https://www.reddit.com/r/SuicideWatch/comments/7opdab/just_called_suicide_hotline_thanks_tom/,0.0,0.0,2018.0,1.0
0,"Being suicidal throughout your young adult years is very strange and leaves you in a weird place when you hit your 20s because you never really had a plan to get this far to begin with, never mind have a plan for the next 50+ years.",,7w5b4g,1485.0,1.0,57.0,2018-02-08 14:54:31,https://www.reddit.com/r/SuicideWatch/comments/7w5b4g/being_suicidal_throughout_your_young_adult_years/,0.0,0.0,2018.0,2.0
1,I hate how when you’re depressed you just forget everything. You forget to do stuff and you forget the stuff you did. Time passes without you realising and instead of doing nothing for ten minutes you did nothing for three hours but you didn’t even realise you were actually living.,,7yaf24,1063.0,1.0,50.0,2018-02-17 23:37:45,https://www.reddit.com/r/SuicideWatch/comments/7yaf24/i_hate_how_when_youre_depressed_you_just_forget/,0.0,0.0,2018.0,2.0
0,"Sorry folks, we've got a troll: Please message the moderators if you get harassed via PM after posting here.","We are **so** sorry that this is necessary.

In recent days we've been targeted by a PM troll who's been sending pro-suicide messages to people after they post here.  The admins have suspended the main account this person was using, and they're looking out for alts, but if these types of individuals sometimes try to get around their site-wide bans.  We feel it's better to let you know this might happen again so that you can be forewarned, and also so that if it does happen, we and the reddit community team will be alerted as soon as possible.

If you get a hateful, pro-suicide PM, please be aware that this person is doing this indiscriminately, and they probably haven't even read what you posted, so it's *not about you*.  

If you don't think you could handle receiving something like that, we completely understand.  In that case, your best protection is to set your messaging preference so that you can receive PMs from trusted users only before you post (anywhere, not just here) about your struggles.  

On desktop you can do that here: 

https://www.reddit.com/prefs/blocked   

(On mobile, it depends which app or browser you're using.)

  

",829s50,1618.0,0.99,308.0,2018-03-05 22:01:55,https://www.reddit.com/r/SuicideWatch/comments/829s50/sorry_folks_weve_got_a_troll_please_message_the/,0.0,0.0,2018.0,3.0
1,Attempt failed. Currently in the hospital.,"I tried I really did, but the second I took the pills I instantly regretted it. I called 911. In the ambulance is when I really noticed what I had done. And having the paramedics there to calm me down and help me was everything to me. I'm currently in the hospital. I can't leave my room unless it's to go to the bathroom. I can't even close my curtain to get privacy. They took every single cable and metal object out of the room. I'm in terrible pain. I didn't sleep at all last night. Hospital beds are the worse. I miss my bed and my dog :( 

Despite the dreary scene of the hospital the nurses and doctors have been nothing but nice and supportive. The nurse who drew my blood even drew a little smiley face on my bandaid to cheer me up a little. One nurse even gave me her number in case I ever need some support. I've never been treated so nicely by a group of strangers. Every single one of them giving me a different purpose to live. Thankfully I didn't ingest too much pills to damage my body too much. Just slight kinda damage but nothing life threatening. 

But this has made me realize a lot. Life really is worth living. No matter your situation. There are PLENTY of people who can be there for you. Every single nurse and doctor here gave me thousands of resources to help me. And this has given me the will to live. 

I should be getting out by Tuesday when a psychiatrist comes to mentally evaluate me and give me permission to leave. Until then I'm in a hospital room prison being watched over like a baby but it's good to know that there's people out there who truly care. 

To all the people considering suicide. Please don't do it. It's not worth it. I truly thought I had no one and my family wouldn't care. But seeing their crying faces when the ambulance took me away made me realize that even when you think you have no one you're wrong. The selfish decision I made will be in my mind forever but it gives me a reason to go on. We're all strong enough if we really try. 

Stay strong and reconsider your choice. 


EDIT: I didn't think my post would get so much attention, seeing as my other posts wouldn't get much. I'm sorry if I can't reply to all of the comments it's really a lot! However, thank you to all the kind people and positive messages. I'm glad to see my story is helping others as well. ",81zuxe,773.0,0.99,86.0,2018-03-04 19:24:58,https://www.reddit.com/r/SuicideWatch/comments/81zuxe/attempt_failed_currently_in_the_hospital/,0.0,0.0,2018.0,3.0
2,Do you guys fantasize about your suicide?,"I think about it a lot. Like I imagine how it'll play out.

 Who would find me, the mess it would make, how my apartment would likely smell of my decomposing corpse and how that would likely give away what actually happened. The process of distributing my stuff and the pain my father and boyfriend would be going through. My co workers finding out, how they would all act surprised and pretend they never saw this coming. 

Do you guys go through the same thing?",84eqkq,566.0,0.99,83.0,2018-03-14 16:31:16,https://www.reddit.com/r/SuicideWatch/comments/84eqkq/do_you_guys_fantasize_about_your_suicide/,0.0,0.0,2018.0,3.0
3,Ever feel like you want to just go to sleep and never wake up instead of actually dying?,,87agkj,501.0,1.0,60.0,2018-03-26 16:29:22,https://www.reddit.com/r/SuicideWatch/comments/87agkj/ever_feel_like_you_want_to_just_go_to_sleep_and/,0.0,0.0,2018.0,3.0
0,I wish I could give my life to someone who wants to live,"Sometimes, I wish I could trade places with a terminal cancer patient who is holding onto life as tightly as he can. I do not have any enthusiasm for life, and it seems like a waste. I feel like I am going through the motions, just waiting to die... and it's going to be a long wait. I have been in therapy for 10 years, and it's constantly like this. I wish euthanasia for mental illness were a thing.

See, there is nothing in this world that brings me joy. I do not have any hobbies, and I do not have a job. I am going to be evicted if I do not find something before May, and while I have been applying, I also don't see the point. I have this black-and-white image in my head-- like a flipbook-- of me going through the motions until I am older enough to retire. I think I would rather cut to the chase because being alive hurts. There mornings where I wake up and take a handful of sleeping pills to make myself fall asleep again. That's really what I am doing... I am waiting to die.

It kind of feels good to type this out. I have not been out of my apartment for almost two weeks. It's almost like I've forgotten what the sound of my own voice sounds like. My boyfriend recently moved away, and we hardly talk anymore. My therapist dumped me (it's a long story + it was kinda my fault, so dont blame her), so I am without support (or structure). I do not have any friends. My family thinks I am being a drama queen and won't ""play"" this game with me anymore. If I were to kill myself tonight, I wonder how long it would take the world to notice. I imagine it would take a while unless my decomposing body starts to smell and a neighbor complains.

I have prescriptions for a whole cocktail of drugs, but I am not 100% certain that an overdose would be successful. I'm 80% sure since I have stimulants and relaxants and sedatives and with some alcohol-- I don't drink, so I image I don't have a lot of tolerance-- it almost feels like I can pull it off. My biggest fear is failing. I am afraid I will only have a seizure and then have to deal with the aftermath of my suicide attempt. God, I don't want to spend more time in a psych ward. 
",8b4hnr,483.0,0.99,45.0,2018-04-10 03:08:49,https://www.reddit.com/r/SuicideWatch/comments/8b4hnr/i_wish_i_could_give_my_life_to_someone_who_wants/,0.0,0.0,2018.0,4.0
0,I was born a hermaphrodite and I want to die because of it.,"I don't even know how to put all of my thoughts down properly here. I've been having terrible emotional breakdowns lately and I have no idea if talking about it will even help. All of the problems in my life are directly tied to a condition I was born with and how I've been treated because of it.

Based on what I know, when I was born my biological sex was ambiguous and doctors tried to have me surgically ""corrected"" into a female. My parents have denied knowing anything about it, but they refuse to let me have access to my medical records even though I'm an adult. The only reasons I have information about it are because of scars, genital pain, and hormone/ internal ultrasound testing from my gyno.

Nothing about my body is sexually correct. I have breasts, but I have male pattern chest hair and pubic hair. I have what should be a vagina, but it's actually just a small hole so narrow that I can't even use a tampon, much less have sex with it. I was born with a phallus, but they shaved it down until it was the appropriate size to be a clitoris. It hurts a lot now, even as an adult. Its like a terrible stinging sensation that gets so bad sometimes that it's brought me to tears before. I can't even touch the left side of it because it stings and burns so badly. 

I've always known that something was wrong about my body, even as a kid I knew that certain things weren't right and that I didn't feel the way that other girls did. My parents refused to acknowledge it and hid everything from me.

My parents were very rigid about gender roles when I was growing up and they punished me whenever I didn't behave like my forcibly assigned sex. Most of my earliest memories are of me crying because I was forced to wear dresses, makeup, and necklaces. I vividly remember begging my mom not to pierce my ears and spending my whole childhood wishing my ears would close up again because wearing earrings made me feel deeply sick.

When I got older, it just got worse. My parents wouldn't let me have hobbies or join clubs that they thought ""weren't for my gender."" they stopped me from doing even simple things like learning to play the trumpet. They refused to ever let me cut my hair above shoulder length and would only let me wear clothes that were ""girl colors"". If I did anything that deviated from what they wanted, they would scream at me and call me a faggot or a dyke. Even now as an adult living in their house they do this, and they've said physically threatening things like ""You're not too old for us to spank you."" 

When I turned 18 I started having serious medical problems. I ended up with an exceedingly rare kidney disorder from a hormone imbalance that came from the surgeries I was forced to have as a baby. I nearly died from it that winter, but still my parents told me nothing about my medical history. 

I didn't get diagnosed until I was 20, when my pain was getting so horrific that I had to quit school and my job. I went for my first visit to a gyno and she told me that I was abnormal. I felt like a complete idiot when she told me. My parents had always pulled  me out of sex ed in school, and I was raised in such a strict religious environment that I sincerely had never seen what anatomy was supposed to look like.

And I felt so broken and stupid then. 

I was so scared of what would happen that I didn't tell my parents anything that my doctor told me. I had been dating my boyfriend for years already and I was so scared to tell him that I waited months before I said anything to him either. 

I just feel like such a failure. I was never even remotely happy as a woman, but I know that my family, my boyfriend, and everyone else could never accept me as a man either. And I've never felt like a man in the first place. I've always felt like I was something between that, even as far back as I can remember. But I know that people could never understand that. Even someone as loving, patient, and kind as my boyfriend can't fully understand how deeply this hurts me.

I feel so completely alone in the world. I feel mutilated. I feel like a disappointment to my family because I can never be what they wanted physically or emotionally. I can't take the pain anymore either. I'm constantly peeing blood and my kidney feels like a knife in my back. I've been suffering from depression and dysphoria since early childhood, and years of therapy haven't helped me. 

I just want it to end. No more talk from my parents about how my entire existence is a sin. No more feeling like I'm a horrible mistake. And no more feeling like it's going to destroy my relationship and hurt the only person who ever truly loved me. 

I wish there were a way to fix this. I wish my parents had left my body alone and raised me in a way where I could have been myself. But now I feel so lost and alone that I don't even know who or what I am.
",8r97s7,544.0,0.99,70.0,2018-06-15 07:50:51,https://www.reddit.com/r/SuicideWatch/comments/8r97s7/i_was_born_a_hermaphrodite_and_i_want_to_die/,0.0,0.0,2018.0,6.0
0,"Have you ever been stuck in a cycle of “I want to live and give a big fuck you to people who kicked me when I was down,” to “I want to kill myself to prove a point” to “nobody gives a shit about me enough for either of those things to happen?”",I am leaning far more towards the last two. ,8z03en,594.0,1.0,42.0,2018-07-15 07:32:13,https://www.reddit.com/r/SuicideWatch/comments/8z03en/have_you_ever_been_stuck_in_a_cycle_of_i_want_to/,0.0,0.0,2018.0,7.0
1,Who else is waiting until they feel they're allowed to kill themselves?,Personally my mom couldn't bear with it so I'm waiting until she passes away. Once this happens I can finally end this misery.,916wnj,478.0,0.99,100.0,2018-07-23 13:07:21,https://www.reddit.com/r/SuicideWatch/comments/916wnj/who_else_is_waiting_until_they_feel_theyre/,0.0,0.0,2018.0,7.0
0,nobody cares if youre suicidal until you actually commit suicide,"I often fantasize about dying. I don't want to be here anymore. it's not even so much out of sadness anymore as it is just out of thinking realistically. there's literally no point. the only thing holding me back from doing it is I don't want to do that to my parents. 
besides feeling like I just want to be dead, I also deal with intense depression and thoughts that torment me. I can't shake the feeling that something is just wrong with me and I'm never going to be happy or deserve to be happy. there's this void in me and no matter what I do, nothing fills it. 

I tried talking to my ex about this while we were dating. I told him about my self harm and how I just want to die. about the self harm, he told me to cut the ""right way"" if I wanted real results. for the depression and suicidal thoughts, he said he felt the same except he had a worse life, so his depression was more justified. he said I have a lot to be happy for. 

it just made me want to kill myself even more. but the thing is, I don't think I want to die. I just wish everything would stop and I could start over as someone else. 
and honestly, when I think about killing myself, I fantasize about it not working, but working just enough to hospitalize me. it's a sick fucking thought, I know.
I think the main reason I want to attempt suicide is so the people around me will realize that I'm not just faking it or ""choosing"" to be depressed. it's not just for attention... which is ironic to say, considering I want to do it literally to get their attention. but I just feel like, in order for my pain to be taken seriously, I need to show it to people somehow.",95icab,720.0,0.99,51.0,2018-08-08 03:03:52,https://www.reddit.com/r/SuicideWatch/comments/95icab/nobody_cares_if_youre_suicidal_until_you_actually/,0.0,0.0,2018.0,8.0
0,Does anyone else constantly teeter between planning how to kill yourself and planning how to fix your life?,,9k53xt,1355.0,1.0,146.0,2018-09-30 09:44:40,https://www.reddit.com/r/SuicideWatch/comments/9k53xt/does_anyone_else_constantly_teeter_between/,0.0,0.0,2018.0,9.0
1,Reminder: NO ACTIVISM is allowed here at any time.,"We know that September 10 was World Suicide Prevention Day.  And, we're all for activism.   But not here, please and thank you.  It takes focus away from our OPs in need of support and understanding.  ",9er28w,1011.0,0.99,118.0,2018-09-10 21:01:47,https://www.reddit.com/r/SuicideWatch/comments/9er28w/reminder_no_activism_is_allowed_here_at_any_time/,0.0,0.0,2018.0,9.0
2,Fuck this pointless world,"Who the fuck decided we needed 12+ years of school then you need to work a miserable job until you die.  Same fucking routine every day, vacations once a year if you're lucky. How can people not be depressed? You're fucking brainwashed if you think that this is how life is supposed to be. ",9ivscs,521.0,0.99,98.0,2018-09-25 20:29:31,https://www.reddit.com/r/SuicideWatch/comments/9ivscs/fuck_this_pointless_world/,0.0,0.0,2018.0,9.0
0,FUUUUUUUUUUUUUUUUUUUUUUUUUUUUUUUUUUUUUUUUUUUUUUUUUUUUUUUUUUUUUUUUUUUUUUUUUUUUUUUUUUUUUUUUUUUUUUUUUUUUUUUUUUUUUUUUUUUUUUUUUUUUUUUUUUUUUUUUUUUUUUUUUUUUUUUUUUUUUUUUUCCCCCCCCCCCCCCCCCCCCCCCCCCCCCCCCCCCCCCCCCCCCCCCCCCCCCCCCCCCCCCCCCCCCCCCCCCCCCCCCCKKKKKKKKKKKKKKKKKKKKKKKKKKKKKKKKKKKKKKKKKKKKKKKKKKKKKKKKK,,9pslw1,937.0,0.98,58.0,2018-10-20 08:55:37,https://www.reddit.com/r/SuicideWatch/comments/9pslw1/fuuuuuuuuuuuuuuuuuuuuuuuuuuuuuuuuuuuuuuuuuuuuuuuuu/,0.0,0.0,2018.0,10.0
1,"I killed my girlfriend, and now I want to kill myself.."," 

Before you read my true story, I want you to know that I'm not very good at English, as it's my second language so bare with me if I have made grammatical mistakes or anything, and honestly I really haven't opened up about this incident in my life, until today.

Anyway,

This one random late night in March 2017, I decided to download the Tinder app (probably the worst decisions in my life) , but I'm genuinely a introvert person, so it's hard for me to make conversation on spot to get to know people. Most people hop on tinder to troll, some to get laid but I was on it to find ""true love"". Fast forward to two months of most girls wanting to just party or I was to boring to form a conversation, this one random day I got super liked by this girl named Laura. We both started to talk, we both had a lot of similarities between us and she was literally 2 miles away from my place. It had been 2 weeks, we both still haven't meet but our conversations started to get more personal, and I felt a real connection between us two. We both replied long, it used to take me a good 45mins to an hour to reply, it was just how it was. It was however odd for me that she was really beautiful, and I was a ugly mf. She came from a small town family, where as me, I was a city kid, from a wealthy family (although she didn't know that for along time).

After the 2 weeks of talking, we both decided to meet up for lunch. Like when I say she was simple, she had no idea about brands or anything. I dressed up with some yeezy 750s, she didn't even know them. And some part of me liked that she was like that, because most of the times, I only wore to show off, to feel rich, to feel accepted. One thing about being rich is that, the definition of happiness is so different to what a average person would say. Like an average person has aspirations of having a nice house, a nice car, nice gadgets and all but it's different being born wealthy, like I had everything that anyone would aspire of having, it's different when you have everything. Anyway that just made me like Laura more because she was a simple person, a bit mysterious and I was always curious to know more about her.

We ended up dating for 6 months, and I knew she was the one for me, she was beautiful, she loved me for who I was, I didn't have to pretend to be this cool dude like I did with my friends, she loved the sensitive little bitch I was. Everything was going well, till (Jan 2018) she called and cried, her father was diagnosed with lung cancer at a bad stage, the doctors said they could cure it but he would only survive for a couple of months. Laura was going through some tough times, but I was always with her, trying to make her strong. She would tell me stories about her dad, like how they used to horse ride back when they used to live on farm lands, and how he would work 14 hours everyday just his both daughters could have the life that every other kid had. Tbh that got me so depressed, like the fact that her father sacrificed so much for his kids and all. But no matter what had happened over the next few months, years or the next decade or so, i said to myself that I would always be with Laura, and I wanted to marry her.

We got back to our casual routines, she was getting better and better, and on her birthday 11th of March, I proposed to her, I honestly didn't know if it was the right time or not, but I felt like I needed to tell her that I'm gonna be committed and not just saying it but i wanted to show her. Laura said yes, cried and hugged so hard that I thought she would break my bones, but I knew that this meant a lot to her.

April 11th 2018.

This part is going to be hard for me, as I am typing my fingers are twitching, I'm really scared, because to say it out is something i haven't done... Anyway, on this very day, I picked up Laura, we were driving to the hospital to visit her dad, we went on the highway. Till this high speeding car (prolly doing 150kmph) tried to overtake a vechile in front of us so we were behind this car, but suddenly suddenly the person slammed the brakes and dropped back, causing me to smash into the car. After this moment, I don't remember a thing. It felt like I died, I could hear my surroundings but I couldn't see anything, Idk how long or anything I woke up and the first thing I asked was ""what happened to laura?"" and my mum started to cry but i thought she was crying for me. I kept asking, and no one replied. Then it hit me, it hit me that she's not alive, and i couldn't understand. It all happened in a flash of a second.. The love of my life was gone, and I could do nothing about it, i didn't know how to take it in, it fucked me up. I only had minor injuries, but I was mentally dead.

Fast forward to a month, I still was in shock, infact I still am.. I went to visit her family, to apologies, but couldn't even let out a word, just cried out loud, but somehow they understood my pain. Laura's dad seemed to be weaker, her mum always had a smile on but she looked so bad, she was in shock and it just made me feel worse and worse. A week later, I found out that Laura's dad had passed away, i wasn't ready for the funeral, I didn't go to laura's too because I couldn't accept it but my mum told me that I had to go to comfort her mum. But laura's mum had completely changed, she didn't want to hear anything from anyone because two of the most people in her life had passed away and I honestly could do nothing but cry looking at her.

Fast forward it to now, there hasn't been a day I felt that I could have done better, I could have reacted better, and if i had turned the other way, maybe I could have died instead of laura, maybe she survived she could have been with her dad for the rest of time, maybe seeing her daughter would have kept him alive for a bit longer, maybe the mum would have been brave having her daughter around. I know it's not my fault, i've heard people say that constantly, it's not fault bro"" but I could have done better, to prevent it, and that is stuck in my mind, and always will. I honestly have no hope for life, I just want to die, i can't get over these thoughts, I just hope I die real soon.... It's not that I want sympathy but I just can't deal with it, it hurts.",9rq2jd,648.0,0.98,61.0,2018-10-27 00:19:01,https://www.reddit.com/r/SuicideWatch/comments/9rq2jd/i_killed_my_girlfriend_and_now_i_want_to_kill/,0.0,0.0,2018.0,10.0
2,You ever wish someone would kill you so you wouldn’t have to do it?,"Purposefully running around late at night through shady places

Not paying attention when nearing roads

Almost “accidentally” getting hit by a car",9l39p9,486.0,0.99,112.0,2018-10-03 17:26:22,https://www.reddit.com/r/SuicideWatch/comments/9l39p9/you_ever_wish_someone_would_kill_you_so_you/,0.0,0.0,2018.0,10.0
0,I don’t want to die. I just wish I had never existed in the first place,,9wegvt,540.0,0.99,56.0,2018-11-12 14:30:11,https://www.reddit.com/r/SuicideWatch/comments/9wegvt/i_dont_want_to_die_i_just_wish_i_had_never/,0.0,0.0,2018.0,10.0
1,Does anyone else feel like they don't want to kill themselves but they wish to die everyday?,"It's hard to kill yourself here, and the person I trusted the most to talk to betrayed me. I just wish everyday maybe a car will hit me, or some mugger will shoot me in the head. ",a0td84,487.0,1.0,84.0,2018-11-27 09:35:46,https://www.reddit.com/r/SuicideWatch/comments/a0td84/does_anyone_else_feel_like_they_dont_want_to_kill/,0.0,0.0,2018.0,10.0
