,Title,Post Text,ID,Score,Upvote Ratio,Total Comments,Created On,Post URL,Original Content,Saved,year,month
0,throwing away my blades today,"been self harming since 12, i’m 22. 

i’m 3 days self harm free.

going to throw my blades away today and fight the good fight.

wish me luck, fellas",blfsjb,2162.0,1.0,129.0,2019-05-06 18:30:06,https://www.reddit.com/r/SuicideWatch/comments/blfsjb/throwing_away_my_blades_today/,0.0,0.0,,
1,anyone else just staying alive for other people at this point?,"i shouldn’t be so miserable. i have a roof over my head and a family that loves me. i have money and can afford luxuries. i go to therapy and take medicine. i have three pets (one a puppy we recently adopted). 

but i just want to die. i’m so lonely, constantly. my heart is so broken and i’m so exhausted i just want to give up and finally kill myself. but i don’t want to hurt my family. i don’t want to think about my dogs waiting for me to come back and not knowing where i’ve gone. i don’t want my mum and dad to blame themselves for it. 

there are some people who’d be glad to see me go. my older sister & youngest sister, most likely. my former friends. idk. 

all i do is disappoint others, i lose them. i can’t do anything. i’m so useless i can’t even kill myself. haha. i’m tired.",bo2ho7,1489.0,0.99,123.0,2019-05-13 11:52:19,https://www.reddit.com/r/SuicideWatch/comments/bo2ho7/anyone_else_just_staying_alive_for_other_people/,0.0,0.0,,
2,My sister committed suicide last night.,"The pain is so heavy in my heart right now. This whole time I thought i was alone, when my sister was feeling the exact same way i am right now. She was only 27. She lives four hours away so we are going to her house now. It’s currently 4:11am in new zealand and all i want to do is cry. We have different dads and we don’t really look a like at all but she was always my number one supporter. She was always there for me and always babysat me when i was little. I have a scar on my pinky from the day she jammed my finger in the door lol. We have so many photos together. She always used to come over for christmas and for my birthdays. I can’t even type right now i’m in so much pain. I still can’t and don’t want to believe this. Someone I knew so well gone just like that.",bs4wb7,1030.0,1.0,59.0,2019-05-23 16:15:55,https://www.reddit.com/r/SuicideWatch/comments/bs4wb7/my_sister_committed_suicide_last_night/,0.0,0.0,,
3,GUILT TRIPPING IS NOT OK,"I've been told all my life ""Don't kill yourself you will hurt everyone else"" "" It's selfish"" ""Think about the people who have no choice"" I fucking know that!!

 You don't think I know that I'm going to make people sad and hurt? Do you even care what I might be going through? 

DON'T TELL PEOPLE THAT IT'S SELFISH. THEY HAVE BEEN TRYING SO HARD. THEY JUST WANT THE PAIN TO END. 

That's all I want. It hurts too much. Stop telling me what I already know. I don't want to hurt anyone but I can't keep doing this shit",bmvkty,765.0,0.98,90.0,2019-05-10 08:02:53,https://www.reddit.com/r/SuicideWatch/comments/bmvkty/guilt_tripping_is_not_ok/,0.0,0.0,,
4,Can we not gatekeep suicidal depression?,"Hello. I had an interesting conversation with another redditor the other day from my post. I was gonna attempt and this person tried to talk me down, only to get agitated at me and say,” you’re only attention seeking and wasting good people’s time.” Like isn’t the point of this subreddit to be a bit attention seeking? I wanted someone to talk me out of it. But don’t tell me that I’m not suicidally depressed, you don’t fucking know me and what I’m going through. You shouldn’t have that attitude if you’re trying to help people on here. Thank you all, I hope you have a good day.",bqim6u,708.0,0.99,53.0,2019-05-19 16:06:55,https://www.reddit.com/r/SuicideWatch/comments/bqim6u/can_we_not_gatekeep_suicidal_depression/,0.0,0.0,,
5,Attempted suicide a few hours ago and I'm shook and so scared.,"I've been at my all time rock-bottom for the past few days and I've been crying every night. It all accumulate this morning when I tried handing myself after my parents left for work. 

It's left me absolutely shook. Even writing this I'm shaking and my breathing is unnatural. I'm so scared, I'm really fucking scared. This is my first attempt so I've never felt anything like this before, the tears, the shaking, all of it. I can't stop crying, I can't believe this is real. Who knows if I'm gonna even be here next week, the way things are going I'm unsure, and this frightens the hell out of me.

I've had a therapist for the last 6 or so months and it really helped, but as soon as I stopped I instantly when back into my depressive state. I don't want to be stuck talking to a therapist my entire life. So I haven't been back and I don't plan too. 

If you've read this far, thank you so much for hearing me out, I just had to say this, I feel sick after what's happened.

Much love to everyone out there. Together, we'll get through this, all of us.


EDIT: Thanks to everyone who took the time to read this and especially to those kind hearted and uplifting comments. I am pretty worried about everything that's been going on with myself but reading the comments has helped to calm me down immensely. Honestly I can't thank you enough.",bpamxk,635.0,0.99,101.0,2019-05-16 10:00:23,https://www.reddit.com/r/SuicideWatch/comments/bpamxk/attempted_suicide_a_few_hours_ago_and_im_shook/,0.0,0.0,,
6,I'm deciding not to take my life.,"I feel like shit, I'm broke, I'm failing and I'm depressed, but fuck it, I'm not killing myself, I'm gonna workout every single day until i become a bodybuilder, and I'm gonna just fight this battle.",bn3clo,594.0,0.98,58.0,2019-05-10 20:27:52,https://www.reddit.com/r/SuicideWatch/comments/bn3clo/im_deciding_not_to_take_my_life/,0.0,0.0,,
7,The fear isn’t in dying. My fear is failing to commit suicide and the pain that I’ll feel as I try.,"If I had a gun it would be easier, but my only options  all require pain. I just have to get past the pain part and I’ll be good to go.

Edit: I really don’t care for what comes after I die.  I just know that it’s better than dealing with what’s here for me. Trust me, I’ve tried my best to keep moving forward in this world, but it’s all been pointless. I have no fear of being dead; I just struggle with the natural human instinct of fearing/avoiding pain. If there’s one thing in this life that I’m sure of, it’s that I want to die and it’s not a fleeting thought. I think about it the majority of every day.

The fact that so many individuals in the comments feel similarly is heartbreaking. Some of us are not fortunate or strong enough to go on living. Some of us have been beat down by life one too many times. I wish that was not the case, but unfortunately it is. It’s really saddening to see. But I sympathize because I feel the same.",bokusd,546.0,1.0,47.0,2019-05-14 16:06:11,https://www.reddit.com/r/SuicideWatch/comments/bokusd/the_fear_isnt_in_dying_my_fear_is_failing_to/,0.0,0.0,,
8,Therapy was the worst thing that happened to me,"A few years ago when I was suicidal I was lied to by my therapist and told we were going to the hospital for an emergency prescription change. At the time, it made sense. But looking back I feel like such an idiot. 

As I got to the hospital I was honest about how I felt suicidal, but made no plans to commit suicide, and had no method. The doctor told me that soon he’d have a discussion with me about what would be best for me. The second they got me a wheelchair I knew my mistake. I shouldn’t have been honest at all. They all lied to me. There was no discussion, no prescription change. They locked me up in the hospital and for three days I didn’t even know how long I’d be there. 

When I finally got to meet with the doctors there, they wouldn’t listen to me and continuously mocked me and treated me like a child. They were obsessed with stupid parts of my life and wouldn’t listen to my diagnosis I told them I already had (Episodic Depression or Major Depressive? I forget because it’s been a few years and we’ve talked about other things) what I do remember is that at the end of the week they said they diagnosed me with the one I already said I have, like it was new!!!! Like THEY diagnosed me and not my psychiatrist at college!! 

One of the stupid things they were obsessed with was my relationship with my best friend (who is a guy- I’m a woman) and I had to repeatedly clarify he was a friend and they kept trying to get more information about it. It was so fucking weird. Like they asked me who my support system was and I said, “my friends, like this girl, that girl, and Guy” and they’re like WHO IS GUY!!!!!!!!!!! Like it would be such an enlightening thing for me to elaborate on even though I already said he’s a friend of mine. 

I had made some friends while I was in there. Some I still keep in contact with. But worst was just that Im now thousands of dollars in debt from this whole experience. 

I had nightmares for weeks. The anxiety of being locked up completely against your will with no way to contact the outside world but a monitored phone did real damage to me. Having no privacy, no real clothes, being constantly treated like a child- it was all so terrible. 

It sucked. It wasn’t worth it. I’ve learned to NEVER tell a therapist you’re suicidal.",bodzsr,534.0,0.98,114.0,2019-05-14 04:15:31,https://www.reddit.com/r/SuicideWatch/comments/bodzsr/therapy_was_the_worst_thing_that_happened_to_me/,0.0,0.0,,
9,I would rather kill myself than grow as a person,"I'm fucking done with life man. Life fucking sucks in every which way. I do not want to be honest about who I am. I do not want yo grow. I do not want to accept anything. I do not want responsible. I don't want to work hard or be a part of anyone's life. I don't want to make a difference or contribute to society. Having a career of any kind is too much fucking work. The truth is I'm perfectly happy to be a leech until nobody is willing to help me out. The. I'll logically be on the streets and at that point I will kill myself. But why let it go that far? Why shouldn't I buy a gun ASAP and be done with it before life even has the opportunity to force me to try being responsible and engaging in the world around me, when I want nothing to do with that? I'm a loser and I'm okay with that. Not being a loser is seriously too much work. Giving enough shit to learn useful things is too much work. I just want to kill myself before anyone that knows me figures out that I don't give a shit about my life or other people and I'm not interested in the least in being responsible in any sense of the word.",br7jos,500.0,0.99,62.0,2019-05-21 07:48:40,https://www.reddit.com/r/SuicideWatch/comments/br7jos/i_would_rather_kill_myself_than_grow_as_a_person/,0.0,0.0,,
10,Anyone else ever feel like suicide gives them hope?,I feel like it's the only way I'll ever be able to escape the hell im slowly creating for myself.,bmgbjc,456.0,0.99,54.0,2019-05-09 06:35:35,https://www.reddit.com/r/SuicideWatch/comments/bmgbjc/anyone_else_ever_feel_like_suicide_gives_them_hope/,0.0,0.0,,
11,Hanging myself tonight so I avoid my birthday and everything else,.,bkwrlt,451.0,0.97,78.0,2019-05-05 11:36:52,https://www.reddit.com/r/SuicideWatch/comments/bkwrlt/hanging_myself_tonight_so_i_avoid_my_birthday_and/,0.0,0.0,,
0,Not a single person actually cares unless you kill yourself,"If you say you're so depressed you can't function it's ""Aw it'll get better"" and they forget about you. Then when you kill yourself everyone's like ""Oh I never would've thought, I wish he would've given some sort of sign.""


I said how many times I want to kill myself and I think I might do it, but I know if I do people will act like it's a huge surprise.


I've been serious all along. I have a rope tied into a noose in a box in my room, so that it's always ready. I'm not joking or just looking for attention when I tell people I need some kind of help. Everybody only pretends to care and then when you're dead tries to say they cared all along",c40k9f,1842.0,0.99,147.0,2019-06-23 07:22:29,https://www.reddit.com/r/SuicideWatch/comments/c40k9f/not_a_single_person_actually_cares_unless_you/,0.0,0.0,2018.0,6.0
1,People don't give a fuck about you until you're dead. I fucking hate humanity,,c68ql2,1322.0,0.99,94.0,2019-06-27 17:59:26,https://www.reddit.com/r/SuicideWatch/comments/c68ql2/people_dont_give_a_fuck_about_you_until_youre/,0.0,0.0,,
2,"I wanted to jump off a bridge, but I got a burrito instead.",I bought a second one and gave it to a homeless guy hanging outside the restaurant. It made me feel a bit better for the rest of the night.,bz8f05,1271.0,1.0,54.0,2019-06-11 05:18:54,https://www.reddit.com/r/SuicideWatch/comments/bz8f05/i_wanted_to_jump_off_a_bridge_but_i_got_a_burrito/,0.0,0.0,,
3,Has anyone been suicidal for so long but don’t have the courage to end it so you end up isolating yourself from everyone so people forget you eventually?,"I’ve cut off my friends for over a year now, but they weren’t really friends, just people I knew in all honesty. I never was able to develop a true friendship in high school due to my reoccurring depression and generalized anxiety. But now, I have no one and it’s mostly caused by my own actions due to deleting all social medias, avoiding social interaction at school and talking to no one. When you’ve given up on life a long time ago, you don’t care if you have friends, so I’ve been isolating myself until noone remembers me. Eventually, I will have the courage to kill myself and when I do, noone will remember if I was even here.",c10o3z,1050.0,1.0,96.0,2019-06-15 18:47:54,https://www.reddit.com/r/SuicideWatch/comments/c10o3z/has_anyone_been_suicidal_for_so_long_but_dont/,0.0,0.0,,
4,"Does anyone else just feel like disappearing socially? Nuking social media, cutting ties to your family & friends, etc?","I am so beyond tired of waking up day in and day out to these negative and intrusive feelings and thoughts being played on repeat in my head. It's to the point where I've been giving more and more thought to just ""disappearing"" from people's lives. Not even saying goodbye -- just disappearing. Obliterating every real connection that I have so I can slip further and further into solitude. Maybe I just want to make it easier for when I finally decide to off myself. I don't know. 

What I do know is that everything feels so... pointless. I can't stop feeling numb and empty. 

I just want to sever all my ties and connections so I can be alone. So I can self-destruct alone.

I can't even remember a time where I felt OK. I don't think I'll ever feel OK again. And it's not ok to feel this way. No one should ever, ever have to feel this way. Ever. 

But yet, some of us do. And it fucking sucks. I wish I could just absorb all the bad feelings everyone in the world has and just take them with me to the grave.",c5zms0,941.0,1.0,80.0,2019-06-27 02:12:14,https://www.reddit.com/r/SuicideWatch/comments/c5zms0/does_anyone_else_just_feel_like_disappearing/,0.0,0.0,,
5,I wish I could give someone else my life,"Some people are fighting to live , they are fighting death every day , it amaze me , wish I can appreciate being able to live but instead I wish to die as soon as possible",c4ochu,659.0,1.0,34.0,2019-06-24 14:00:21,https://www.reddit.com/r/SuicideWatch/comments/c4ochu/i_wish_i_could_give_someone_else_my_life/,0.0,0.0,,
6,Does anyone else think about suicide every few seconds?,"It's constantly on my mind. It doesn't matter what I'm doing. If I'm at work, or home or outside. The thoughts are always there. I'm talking about literally every 10-20 seconds I think about killing myself.",c1qw03,656.0,0.99,73.0,2019-06-17 18:06:33,https://www.reddit.com/r/SuicideWatch/comments/c1qw03/does_anyone_else_think_about_suicide_every_few/,0.0,0.0,,
7,Nobody genuinely wants to help you in the real world,"If you start getting depressed or lash out, first thing they'll think of you is you are dangerous. They'll look for a solution in mental institutions, medicine, restraining - anything to keep you from doing harm. 

They'll call you selfish for bringing hurt to them by trying to solve your own hurts. To them, you should suffer in silence and never exist.

The stories in the movies, books, etc. are all wrong. Humans are selfish, first and foremost. Jesus does not exist in real life. And no, he will not come to comfort you or understand you in your darkest moments. Nobody will, that's why it's just a myth.

To them, you're just an animal. A human turned into a zombie, that needs to be taken out. Your emotions aren't valid responses to your environment. To them, you are broken.",bvuvhb,614.0,0.97,54.0,2019-06-02 07:13:18,https://www.reddit.com/r/SuicideWatch/comments/bvuvhb/nobody_genuinely_wants_to_help_you_in_the_real/,0.0,0.0,,
8,"I asked last Saturday if ""Anyone there"" ? You answered. Thank you. I was half way through my suicide attempt.","I was on this site last week and need someone that I didn't know.  I'm not doing well lately. I have a toxic abusive relationship, I cannot find a shrink to save my life (Literally. ha), I'm going through a divorce, my soul mate died (dog), I'm having to move states, find work, find a new home, and am living with my parents as of my psychiatric hospital release the day before yesterday.

I had been half way through, and had 2 methods essentially.  I took a medication to make it so I wasn't scared to do it. In the closet I was in, I had my phone, I'd already filled out my suicide note, and dictated in my legal will and burial details what needed to be done. I wanted to go forward.  I can't now, but think if it were again ... I would have not called for help but just let one of the methods run its course and go to sleep. I wouldn't wake up again. I am still ok with that idea.

I stood in the closet and had a fraction of a second that I was sobbing trying to pump myself up and asked if anyone was here.  It didn't save my life, but it gave me a second to think that wasn't thinking about the problem, it was writing and reading. I put \*\*\* \*\*\* down. I called my husband (STBX) and was taken by ambulance.  I was put in a hospital for a 5 day week and am now at my parents house. Everything is locked up, I have no access to anything. I don't have my car. I'm safe.

but Thank you. I wanted to tell someone what happened. I need to feel less confused about it and why or if I'm a risk, or if I'm being dramatic. I can't tell. But I can't talk about it at home. I'm sad and embarrassed to be here.  


Edited to remove specific methods of suicide attempt.",c79p5n,616.0,0.99,35.0,2019-06-30 05:45:21,https://www.reddit.com/r/SuicideWatch/comments/c79p5n/i_asked_last_saturday_if_anyone_there_you/,0.0,0.0,,
9,"Any body else feel, stressed/anxious /guilty/hopeful /hopeless /scared/sad /suicidal /all in around a 24 hour period give or take?",,byd713,583.0,1.0,61.0,2019-06-08 22:06:58,https://www.reddit.com/r/SuicideWatch/comments/byd713/any_body_else_feel_stressedanxious_guiltyhopeful/,0.0,0.0,,
10,I'll be ignored again...,Nobody is going bother reading this but thank you if you do. I'm tired of being invisible. I just want to be cared. I'm tired of looking at an empty notifications screen. I don't remember the last time I went out with someone. Everyone around me is enjoying their lives except me. I don't want to wake up ever again if this is what it will be like for rest of my life.,bxfkrg,578.0,0.99,91.0,2019-06-06 11:22:32,https://www.reddit.com/r/SuicideWatch/comments/bxfkrg/ill_be_ignored_again/,0.0,0.0,,
11,No offense but i rather kill myself while i am in my 20s than wasting my entire life working for the success of someone else-barely surviving in this cruel world .,,c7ivm0,553.0,0.99,49.0,2019-06-30 20:04:44,https://www.reddit.com/r/SuicideWatch/comments/c7ivm0/no_offense_but_i_rather_kill_myself_while_i_am_in/,0.0,0.0,,
12,Every day my desire for suicide increasessssssssss,,c523un,544.0,0.98,69.0,2019-06-25 04:01:45,https://www.reddit.com/r/SuicideWatch/comments/c523un/every_day_my_desire_for_suicide_increasessssssssss/,0.0,0.0,,
13,Whoever says life is a gift can fucking catch these hands,,bxzkkh,540.0,0.98,46.0,2019-06-07 20:41:35,https://www.reddit.com/r/SuicideWatch/comments/bxzkkh/whoever_says_life_is_a_gift_can_fucking_catch/,0.0,0.0,,
14,ever feel like you weren't meant to be in this world?,"I feel like I belong nowhere. A lot of the time, when I try doing something I always wanted to do, I ask myself after ""is that really it?"". I feel like I should be in another world or something",c3j651,529.0,1.0,47.0,2019-06-22 00:59:51,https://www.reddit.com/r/SuicideWatch/comments/c3j651/ever_feel_like_you_werent_meant_to_be_in_this/,0.0,0.0,,
15,"Does anyone get horrible, horrible heartache that literally is so physically painful?","When I'm sad, like really, really, sad, I get these sharp pains in my heart that are continuous and jerk tears. It hurts so much at times that it spreads throughout my body and I flinch and curl up in pain while my tears uncontrollably drop down my cheeks. My stomach hurts, and my whole body begins to ache, my head starts to pound and that's when I find comfort in the idea of ending it all - that there's a way out. Thinking about it gives me comfort. Writing letters to everyone gives me comfort. Until it feels real and it all comes back and I miss people that I love. I miss the way things were and I miss when i didn't fuck everything up. I miss when I was loved unconditionally.",byl475,516.0,0.99,92.0,2019-06-09 15:05:53,https://www.reddit.com/r/SuicideWatch/comments/byl475/does_anyone_get_horrible_horrible_heartache_that/,0.0,0.0,,
16,Y'all ever just lay down in bed in the fetal position and cry and just try to will yourself out of existence for a couple hours?,Anyone else do this?,bxqbjf,468.0,1.0,52.0,2019-06-07 04:16:24,https://www.reddit.com/r/SuicideWatch/comments/bxqbjf/yall_ever_just_lay_down_in_bed_in_the_fetal/,0.0,0.0,,
0,I feel embarrassed but....does anyone else get extremely depressed and suicidal when you see a cute person and remember that you’ll always be single and never have a family of your own,,cbk8i7,2286.0,0.99,241.0,2019-07-10 18:13:12,https://www.reddit.com/r/SuicideWatch/comments/cbk8i7/i_feel_embarrassed_butdoes_anyone_else_get/,0.0,0.0,2019.0,7.0
